stock_code,description
21709,FOLDING UMBRELLA CHOCOLATE POLKADOT
75178,ASSTD COL BUTTERFLY/CRYSTAL W/CHIME
23243,SET OF TEA COFFEE SUGAR TINS PANTRY
90214E,"LETTER 'E'"" BLING KEY RING"""
37330,BIG POLKADOT MUG
21578,WOODLAND DESIGN  COTTON TOTE BAG
84840,SWEETHEART CARRY-ALL BASKET
90196B,BLACK GEMSTONE NECKLACE 45CM
75131,METAL TUBE CHIME ON BAMBOO
22561,WOODEN SCHOOL COLOURING SET
90209A,PURPLE ENAMEL+GLASS HAIR COMB
21810,CHRISTMAS HANGING STAR WITH BELL
90185D,CRYSTAL DIAMANTE EXPANDABLE RING
21027,NINJA RABBIT PINK
23226,FILIGREE HEART DAISY WHITE
85084,HOLLY TOP CHRISTMAS STOCKING
84857B,BLUE MONTE CARLO HANDBAG
20910,VINTAGE PHOTO ALBUM PARIS DAYS
23071,MARIE ANTOIENETT TRINKET BOX GOLD
20661,BLUE POLKADOT PURSE 
79144B,PAINTED LIGHTBULB STAR+ MOON
22701,PINK DOG BOWL
22965,3 TRADITIONAl BISCUIT CUTTERS  SET
35004B,SET OF 3 BLACK FLYING DUCKS
46776B,WOVEN BERRIES CUSHION COVER 
82482,WOODEN PICTURE FRAME WHITE FINISH
23306,SET OF 36 DOILIES PANTRY DESIGN
20832,RED FLOCK LOVE HEART PHOTO FRAME
22730,ALARM CLOCK BAKELIKE IVORY
21060,PARTY INVITES BALLOON GIRL
82616B,FRAPPUCINO SCARF KNITTING KIT
21977,PACK OF 60 PINK PAISLEY CAKE CASES
47421,ASSORTED COLOUR LIZARD SUCTION HOOK
90012A,MIDNIGHT BLUE DROP CRYSTAL NECKLACE
35815P,"ACRYLIC JEWEL SNOWFLAKE, PINK"
22735,RIBBON REEL SOCKS AND MITTENS
90161D,ANT COPPER PINK BOUDICCA BRACELET
85039C,S/4 BLACK MINI ROSE CANDLE IN BOWL
21786,POLKADOT RAIN HAT 
90214A,"LETTER 'A'"" BLING KEY RING"""
21955,DOORMAT UNION JACK GUNS AND ROSES
85024C,PINK SMALL JEWELLED PHOTOFRAME
20682,RED RETROSPOT CHILDRENS UMBRELLA
85163B,BLACK BAROQUE WALL CLOCK 
35591T,TURQUOISE CHRISTMAS TREE 
90170,DAISY HAIR BAND
21633,SUNFLOWER DECORATIVE PARASOL
84746,PINK EASTER HENS+FLOWER
22972,CHILDREN'S SPACEBOY MUG
22891,TEA FOR ONE POLKADOT
20845,ZINC HEART LATTICE 2 WALL PLANTER
23176,ABC TREASURE BOOK BOX 
22148,EASTER CRAFT 4 CHICKS 
21555,CERAMIC STRAWBERRY TRINKET TRAY
22075,6 RIBBONS ELEGANT CHRISTMAS 
23547,WRAP FLOWER SHOP  
22471,TV DINNER TRAY AIR HOSTESS 
20763,DAISY SKETCHBOOK 
21670,BLUE SPOT CERAMIC DRAWER KNOB
20674,GREEN POLKADOT BOWL
22749,FELTCRAFT PRINCESS CHARLOTTE DOLL
23009,I LOVE LONDON BABY GIFT SET
84249A,"GREETING CARD,SQUARE, DOUGHNUTS"
22521,CHILDS GARDEN TROWEL PINK
85129B,BEADED CRYSTAL HEART GREEN SMALL
22859,EASTER TIN BUNNY BOUQUET
22597,CHRISTMAS MUSICAL ZINC HEART 
84201C,HAPPY BIRTHDAY CARD TEDDY/CAKE
22310,IVORY KNITTED MUG COSY 
84347,ROTATING SILVER ANGELS T-LIGHT HLDR
23012,GLASS APOTHECARY BOTTLE PERFUME
85130B,BEADED CRYSTAL HEART GREEN LARGE
22203,MILK PAN RED RETROSPOT
20974,12 PENCILS SMALL TUBE SKULL
22158,3 HEARTS HANGING DECORATION RUSTIC
23018,LARGE APOTHECARY MEASURING JAR 
84678,CLASSICAL ROSE SMALL VASE
23134,LARGE ZINC HEART WALL ORGANISER
20820,SILVER LOOKING MIRROR
21464,DISCO BALL ROTATOR BATTERY OPERATED
23319,BOX OF 6 MINI 50'S CRACKERS
71279,PINK GLASS CANDLEHOLDER
90129C,GREEN GLASS TASSLE BAG CHARM
22546,MINI JIGSAW PURDEY
90010E,AMBER GLASS/SILVER BRACELET
21876,POTTERING MUG
90201B,BLACK ENAMEL FLOWER RING
21158,MOODY GIRL DOOR HANGER 
17012A,ORIGAMI VANILLA INCENSE/CANDLE SET 
84510A,SET OF 4 ENGLISH ROSE COASTERS
23144,ZINC T-LIGHT HOLDER STARS SMALL
22987,WRAP SUMMER ROSE DESIGN
21903,MAN FLU METAL SIGN
84341B,SMALL PINK MAGIC CHRISTMAS TREE
23013,GLASS APOTHECARY BOTTLE TONIC
21242,RED RETROSPOT PLATE 
22547,MINI JIGSAW DINOSAUR 
47480,HANGING PHOTO CLIP ROPE LADDER
22896,PEG BAG APPLE DESIGN
90035C,"PEARL & SHELL 42'NECKL. IVORY"""
22757,LARGE RED BABUSHKA NOTEBOOK 
84969,BOX OF 6 ASSORTED COLOUR TEASPOONS
90114,SUMMER DAISIES BAG CHARM
22754,SMALL RED BABUSHKA NOTEBOOK 
23148,MINIATURE ANTIQUE ROSE HOOK IVORY
90014C,SILVER AND BLACK ORBIT NECKLACE
23376,PACK OF 12 VINTAGE CHRISTMAS TISSUE
23104,IVORY CAFE HANGING LAMP 
44235,ASS COL CIRCLE MOBILE 
90085,CRYSTAL STILETTO PHONE CHARM
20803,SMALL PINK GLASS SUNDAE DISH
23508,MINI PLAYING CARDS DOLLY GIRL 
22430,ENAMEL WATERING CAN CREAM
21662,VINTAGE GLASS COFFEE CADDY
22102,MIRROR MOSAIC T-LIGHT HOLDER 
23503,PLAYING CARDS KEEP CALM & CARRY ON
17090A,LAVENDER INCENSE 40 CONES IN TIN
22578,WOODEN STAR CHRISTMAS SCANDINAVIAN
22059,CERAMIC STRAWBERRY DESIGN MUG
23316,RED REFECTORY CLOCK 
21259,VICTORIAN SEWING BOX SMALL 
23351,ROLL WRAP 50'S CHRISTMAS
48184,DOORMAT ENGLISH ROSE 
22566,FELTCRAFT HAIRBAND PINK AND PURPLE
84821,DANISH ROSE DELUXE COASTER
22479,DAISY GARDEN MARKER
22545,MINI JIGSAW BUNNIES
23357,HOT WATER BOTTLE SEX BOMB
16219,HOUSE SHAPE PENCIL SHARPENER
23119,PACK OF 6 LARGE FRUIT STRAWS 
22354,RETROSPOT PADDED SEAT CUSHION
90199C,5 STRAND GLASS NECKLACE CRYSTAL
85061W,WHITE JEWELLED HEART DECORATION
72351B,SET/6 PINK  BUTTERFLY T-LIGHTS
22231,JIGSAW TREE WITH BIRDHOUSE
20701,PINK CAT FLORAL CUSHION COVER 
77079,DOLPHIN WINDMILL
62096B,PURPLE/TURQ FLOWERS HANDBAG
23240,SET OF 4 KNICK KNACK TINS  DOILEY 
20773,BLUE PAISLEY NOTEBOOK
84638,SMALL KITCHEN FLOWER POTS PLAQUE
35598B,BLACK CHRISTMAS TREE 60CM
22785,SQUARECUSHION COVER PINK UNION FLAG
22557,PLASTERS IN TIN VINTAGE PAISLEY 
20984,12 PENCILS TALL TUBE POSY
84539,KNITTED RABBIT DOLL 
22403,MAGNETS PACK OF 4 VINTAGE LABELS 
90030B,RED KUKUI COCONUT SEED NECKLACE
15056P,EDWARDIAN PARASOL PINK
35599B,BLACK CHRISTMAS TREE 120CM
20619,TROPICAL PASSPORT COVER 
23464,VINTAGE ZINC WATERING CAN SMALL
85169D,PINK LOVE BIRD CANDLE
85145,JARDIN ETCHED GLASS LARGE BELL JAR
22900, SET 2 TEA TOWELS I LOVE LONDON 
23500,KEY RING BASEBALL BOOT ASSORTED 
21194,PINK  HONEYCOMB PAPER FAN
17038,PORCELAIN BUDAH INCENSE HOLDER
23239,SET OF 4 KNICK KNACK TINS POPPIES
22555,PLASTERS IN TIN STRONGMAN
84991,60 TEATIME FAIRY CAKE CASES
20902,VINTAGE KEEPSAKE BOX PARIS DAYS
20793,BLUE TILED TRAY
84536A,ENGLISH ROSE NOTEBOOK A7 SIZE
22258,FELT FARM ANIMAL RABBIT
22262,FELT EGG COSY CHICKEN
90200D,PINK SWEETHEART BRACELET
21200,MULTICOLOUR HONEYCOMB PAPER GARLAND
21164,HOME SWEET HOME METAL SIGN 
22652,TRAVEL SEWING KIT
22674,FRENCH TOILET SIGN BLUE METAL
21836,GINGHAM OVEN GLOVE RED HEART 
21407,BROWN CHECK CAT DOORSTOP 
47574A,ENGLISH ROSE SCENTED HANGING FLOWER
21377,SMALL CAMPHOR WOOD FIELD  MUSHROOM
23429,RED RETRO KITCHEN WALL CLOCK
84997C,BLUE 3 PIECE POLKADOT CUTLERY SET
35598A,DUSTY PINK CHRISTMAS TREE 60CM
22291,HANGING CHICK CREAM DECORATION
23249,ENAMEL DINNER PLATE PANTRY
84247K,"FOLK ART GREETING CARD,pack/12"
35968,FOLK ART METAL HEART T-LIGHT HOLDER
84881,BLUE WIRE SPIRAL CANDLE HOLDER
22327,ROUND SNACK BOXES SET OF 4 SKULLS
90063A,WHITE VINT ART DECO CRYSTAL NECKLAC
22532,MAGIC DRAWING SLATE LEAP FROG 
22683,FRENCH BLUE METAL DOOR SIGN 8
90144,SILVER DROP EARRINGS WITH FLOWER
21240,BLUE POLKADOT CUP
47343A,FUSCHIA FLOWER PURSE WITH BEADS
21683,MEDIUM MEDINA STAMPED METAL BOWL 
21216,"SET 3 RETROSPOT TEA,COFFEE,SUGAR"
90148,LONG SILVER NECKLACE PASTEL FLOWER
22577,WOODEN HEART CHRISTMAS SCANDINAVIAN
16216,LETTER SHAPE PENCIL SHARPENER
22880,NUMBER TILE VINTAGE FONT 1
22472,TV DINNER TRAY DOLLY GIRL
90036D,"FLOWER GLASS GARLAND NECKL.36'BLACK"""
20615,BLUE POLKADOT PASSPORT COVER
22448,PIN CUSHION BABUSHKA RED
22466,FAIRY TALE COTTAGE NIGHT LIGHT
21261,GREEN GOOSE FEATHER CHRISTMAS TREE 
22986,GINGHAM ROSE WRAP
22955,36 FOIL STAR CAKE CASES 
84816,DANISH ROSE BEDSIDE CABINET
85132B,CHARLIE AND LOLA TABLE TINS
90214Z,"LETTER 'Z'"" BLING KEY RING"""
22100,SKULLS SQUARE TISSUE BOX
21636,MADRAS NOTEBOOK MEDIUM
90202C,GREEN ENAMEL FLOWER HAIR TIE
21132,SILVER STANDING GNOME   
21741,COSY SLIPPER SHOES LARGE GREEN
22454,MEASURING TAPE BABUSHKA RED
21626,VINTAGE UNION JACK PENNANT
21197,MULTICOLOUR  CONFETTI IN TUBE
23233,WRAP POPPIES  DESIGN
22569,FELTCRAFT CUSHION BUTTERFLY
23057,BEADED CHANDELIER T-LIGHT HOLDER
21369,MIRRORED WALL ART SPLODGES
22995,TRAVEL CARD WALLET SUKI
21641,ASSORTED TUTTI FRUTTI KEYRING BALL
22923,FRIDGE MAGNETS LES ENFANTS ASSORTED
15060B,FAIRY CAKE DESIGN UMBRELLA
22215,CAKE STAND WHITE TWO TIER LACE
21531,RED RETROSPOT SUGAR JAM BOWL
22402,MAGNETS PACK OF 4 VINTAGE COLLAGE
90049,IVORY GOLD METAL BAG CHARM
37351,ORANGE FLOWER MUG 
85214,TUB 24 PINK FLOWER PEGS
23576,SNACK TRAY RED VINTAGE DOILY
90175D,TIGRIS EYE CHUNKY CHARM BRACELET
21829,DINOSAUR KEYRINGS ASSORTED
23145,ZINC T-LIGHT HOLDER STAR LARGE
90145,SILVER HOOP EARRINGS WITH FLOWER
22099,CARAVAN SQUARE TISSUE BOX
16161U,WRAP SUKI AND FRIENDS
21014,SWISS CHALET TREE DECORATION 
20675,BLUE POLKADOT BOWL
22708,WRAP DOLLY GIRL
21539,RED RETROSPOT BUTTER DISH
22687,DOORMAT CHRISTMAS VILLAGE
22922,FRIDGE MAGNETS US DINER ASSORTED
23449,SET OF 6 EASTER RAINBOW CHICKS
23528,SPACEBOY WALL ART
21114,LAVENDER SCENTED FABRIC HEART
21586,KINGS CHOICE GIANT TUBE MATCHES
90038A,GLASS AND PAINTED BEADS BRACELET TO
20837,FRENCH FLORAL CUSHION COVER 
21851,LILAC DIAMANTE PEN IN GIFT BOX
22355,CHARLOTTE BAG SUKI DESIGN
23085,ANTIQUE SILVER BAUBLE LAMP  
37379A,PINK CHERRY BLOSSOM CUP & SAUCER
23116,VEGETABLE GARDEN CHOPPING BOARD
22197,POPCORN HOLDER
17001,HEAVENS SCENT FRAGRANCE OILS ASSTD
37464,ROBOT MUG IN DISPLAY BOX
23184,BULL DOG BOTTLE OPENER
23093,SMALL PARISIENNE HEART PHOTO FRAME 
23027,DRAWER KNOB VINTAGE GLASS HEXAGON
22799,SWEETHEART WIRE FRUIT BOWL
85125,SMALL ROUND CUT GLASS CANDLESTICK
21112,SWISS ROLL TOWEL PINK  SPOTS
22358,KINGS CHOICE TEA CADDY 
22227,HANGING HEART MIRROR DECORATION 
85019B,BLOSSOM  IMAGES NOTEBOOK SET
22453,MEASURING TAPE BABUSHKA BLUE
72369A,PINK CLEAR GLASS CANDLE PLATE
22536,MAGIC DRAWING SLATE PURDEY
23552,BICYCLE PUNCTURE REPAIR KIT 
21411,GINGHAM HEART  DOORSTOP RED
84789,ENCHANTED BIRD PLANT CAGE
21664,RIDGED GLASS STORAGE JAR CREAM LID
21291,SMALL POLKADOT CHOCOLATE GIFT BAG 
84086B,YELLOW/BLUE RETRO RADIO
22622,BOX OF VINTAGE ALPHABET BLOCKS
22672,FRENCH BATHROOM SIGN BLUE METAL
90060B,FIRE POLISHED GLASS NECKL GOLD
84792,ENCHANTED BIRD COATHANGER 5 HOOK
23511,EMBROIDERED RIBBON REEL EMILY 
22161,HEART DECORATION RUSTIC HANGING 
17012D,ORIGAMI ROSE INCENSE/CANDLE SET 
22029,SPACEBOY BIRTHDAY CARD
22973,CHILDREN'S CIRCUS PARADE MUG
37450,CERAMIC CAKE BOWL + HANGING CAKES
21425,SKULLS STORAGE BOX LARGE
85208,SET/12 FUNKY FELT FLOWER PEG IN BAG
22196,SMALL HEART MEASURING SPOONS
84832,ZINC WILLIE WINKIE  CANDLE STICK
15044C,PURPLE PAPER PARASOL
84625A,PINK NEW BAROQUECANDLESTICK CANDLE
22688,DOORMAT PEACE ON EARTH BLUE
23000,TRAVEL CARD WALLET TRANSPORT
85230A,OPIUM SCENTED VOTIVE CANDLE
21286,RETROSPOT CANDLE  LARGE
21788,KIDS RAIN MAC BLUE
22599,CHRISTMAS MUSICAL ZINC STAR
35923,CANDY HEART HANGING DECORATION
85197,SET OF 12 MINI BUNNIES IN A BUCKET
21378,SMALL TALL CAMPHOR WOOD TOADSTOOL
23137,ZINC WIRE SWEETHEART LETTER TRAY
21650,ASSORTED TUTTI FRUTTI BRACELET
22919,HERB MARKER MINT
23417,BATHROOM HOOK
22998,TRAVEL CARD WALLET KEEP CALM
22950,36 DOILIES VINTAGE CHRISTMAS
23492,VINTAGE JINGLE BELLS WREATH
23179,CLOCK MAGNET MUM'S KITCHEN
84849B,FAIRY SOAP SOAP HOLDER
23204,CHARLOTTE BAG APPLES DESIGN
84569B,PACK 3 FIRE ENGINE/CAR PATCHES
85048,15CM CHRISTMAS GLASS BALL 20 LIGHTS
35913B,WHITE/PINK CHICK EASTER DECORATION
22789,T-LIGHT HOLDER SWEETHEART HANGING
23110,PARISIENNE KEY CABINET 
84800S,SMALL WHITE/PINK ROSE ART FLOWER
23139,SINGLE WIRE HOOK PINK HEART
22920,HERB MARKER BASIL
85025C,PINK HEART SHAPE PHOTO FRAME
23200,JUMBO BAG PEARS
84988,SET OF 72 PINK HEART PAPER DOILIES
84823,DANISH ROSE FOLDING CHAIR
21340,CLASSIC METAL BIRDCAGE PLANT HOLDER
90003B,ROSE COLOUR PAIR HEART HAIR SLIDES
22360,GLASS JAR ENGLISH CONFECTIONERY
22776,"CAKESTAND, 3 TIER, LOVEHEART"
85179C,PINK BITTY LIGHT CHAIN
84877D,BLUE ROUND COMPACT MIRROR
23289,DOLLY GIRL CHILDRENS BOWL
22329,ROUND CONTAINER SET OF 5 RETROSPOT
23509,MINI PLAYING CARDS FUN FAIR 
21488,RED WHITE SCARF  HOT WATER BOTTLE
23475,WOODLAND SMALL PINK FELT HEART
23058,CHRISTMAS HANGING SNOWFLAKE
85034C,3 ROSE MORRIS BOXED CANDLES
21123,SET/10 IVORY POLKADOT PARTY CANDLES
84597C,RETRO PINK BALL ASHTRAY 
22500,SET OF 2 TINS JARDIN DE PROVENCE
84212,"ASSORTED FLOWER COLOUR 'LEIS'"""""
35819B,"ACRYLIC HANGING JEWEL,BLUE"
90125E,AMBER BERTIE GLASS BEAD BAG CHARM
22385,JUMBO BAG SPACEBOY DESIGN
90201C,RED ENAMEL FLOWER RING
72783,BLACK SIL'T SQU CANDLE PLATE 
85136C,RED SHARK HELICOPTER
90143,SILVER BRACELET W PASTEL FLOWER
90162C,ANT SILVER FUSCHIA BOUDICCA RING
22375,AIRLINE BAG VINTAGE JET SET BROWN
22548,HEADS AND TAILS SPORTING FUN
85159B,"WHITE TEA,COFFEE,SUGAR JARS"
22571,ROCKING HORSE RED CHRISTMAS 
23051,RECYCLED ACAPULCO MAT BLUE
20759,CHRYSANTHEMUM POCKET BOOK 
21392,RED POLKADOT PUDDING BOWL
22978,PANTRY ROLLING PIN
21265,PINK GOOSE FEATHER TREE 60CM
85127,SMALL SQUARE CUT GLASS CANDLESTICK
90022,EDWARDIAN DROP EARRINGS JET BLACK
22673,FRENCH GARDEN SIGN BLUE METAL
22644,CERAMIC CHERRY CAKE MONEY BANK
79071B,ENGLISH ROSE METAL WASTE BIN
84944,SET OF 6 KASHMIR FOLKART BAUBLES
21747,SMALL SKULL WINDMILL
22595,CHRISTMAS GINGHAM HEART
84679,CLASSICAL ROSE TABLE LAMP
90199B,5 STRAND GLASS NECKLACE AMETHYST
22841,ROUND CAKE TIN VINTAGE GREEN
21648,ASSORTED TUTTI FRUTTI SMALL PURSE
35915B,BLUE KNITTED HEN 
21100,CHARLIE AND LOLA CHARLOTTE BAG
82567,"AIRLINE LOUNGE,METAL SIGN"
22107,PIZZA PLATE IN BOX
20956,PORCELAIN T-LIGHT HOLDERS ASSORTED
21015,DARK BIRD HOUSE TREE DECORATION
22367,CHILDRENS APRON SPACEBOY DESIGN
23499,SET 12 VINTAGE DOILY CHALK 
20616,CHERRY BLOSSOM PASSPORT COVER
35809A,ENAMEL PINK TEA CONTAINER
71495B,CD WALL TIDY RED FLOWERS
20699,MOUSEY LONG LEGS SOFT TOY
82484,WOOD BLACK BOARD ANT WHITE FINISH
22771,CLEAR DRAWER KNOB ACRYLIC EDWARDIAN
90214V,"LETTER 'V'"" BLING KEY RING"""
23347,I LOVE LONDON BEAKER
84709B,PINK OVAL JEWELLED MIRROR
47599B,BLUE PARTY BAGS 
46776E,WOVEN CANDY CUSHION COVER 
23136,IVORY WIRE SWEETHEART LETTER TRAY
22111,SCOTTIE DOG HOT WATER BOTTLE
84875B,GREEN SQUARE COMPACT MIRROR
23206,LUNCH BAG APPLE DESIGN
23191,BUNDLE OF 3 RETRO EXERCISE BOOKS
35965,FOLKART HEART NAPKIN RINGS
22482,BLUE TEA TOWEL CLASSIC DESIGN
22101,MIRROR MOSAIC VOTIVE HOLDER
35471D,SET OF 3 BIRD LIGHT PINK FEATHER 
22344,PARTY PIZZA DISH PINK POLKADOT
23003,TRAVEL CARD WALLET VINTAGE ROSE 
84378,SET OF 3 HEART COOKIE CUTTERS
21943,CAKES AND RABBITS DESIGN FLANNEL 
22192,BLUE DINER WALL CLOCK
17014A,ORIGAMI VANILLA INCENSE CONES
21070,VINTAGE BILLBOARD MUG 
21210,SET OF 72 RETROSPOT PAPER  DOILIES
21630,FLOOR CUSHION ELEPHANT CARNIVAL
85180A,RED HEARTS LIGHT CHAIN 
21401,BLUE PUDDING SPOON
21896,POTTING SHED TWINE
21128,GOLD FISHING GNOME
84751B,BLACK MEDIUM GLASS CAKE STAND
23072,MARIE ANTOINETTE TRINKET BOX SILVER
47594B,SCOTTIES DESIGN WASHBAG
90041,PEARL AND CHERRY QUARTZ BRACLET
79151B,"SILICON CUBE 25W, BLUE"
20856,DENIM PATCH PURSE PINK BUTTERFLY
21012,ANTIQUE ALL GLASS CANDLESTICK
35966,FOLKART CHRISTMAS TREE T-LIGHT HOLD
21802,CHRISTMAS TREE HEART DECORATION
90054,CRACKED GLAZE EARRINGS RED
17003,BROCADE RING PURSE 
20618,QUEEN OF THE SKIES PASSPORT COVER 
20898,VINTAGE NOTEBOOK TRAVELOGUE
85185D,FROG SOCK PUPPET
90178A,AMBER CHUNKY GLASS+BEAD NECKLACE
48194,DOORMAT HEARTS
20771,CHRYSANTHEMUM  JOURNAL
85230E,STRAWBRY SCENTED VOTIVE CANDLE
90214C,"LETTER 'C'"" BLING KEY RING"""
23151,ZINC SWEETHEART SOAP DISH
79000,MOROCCAN TEA GLASS
23087,ZINC  HEART T-LIGHT HOLDER
21320,GLASS CHALICE GREEN  LARGE 
85198,ASSORTED FARMYARD ANIMALS IN BUCKET
21218,RED SPOTTY BISCUIT TIN
23244,CANNISTER VINTAGE LEAF DESIGN
23045,PAPER LANTERN 5 POINT STAR MOON 
23238,SET OF 4 KNICK KNACK TINS LONDON 
90116,FRUIT SALAD BAG CHARM
22383,LUNCH BAG SUKI  DESIGN 
85206A,CREAM FELT EASTER EGG BASKET
72122,COFFEE SCENT PILLAR CANDLE
22134,LADLE LOVE HEART RED 
85169B,BLACK LOVE BIRD CANDLE
23169,CLASSIC GLASS COOKIE JAR
21745,GAOLERS KEYS DECORATIVE GARDEN 
35637A,IVORY STRING CURTAIN WITH POLE 
85230F,JASMINE VOTIVE CANDLE
20826,SILVER APERITIF GLASS
90123C,GREEN HEART OF GLASS BRACELET
35912B,WHITE/PINK CHICK DECORATION
22417,PACK OF 60 SPACEBOY CAKE CASES
84459A,PINK METAL CHICKEN HEART 
21668,RED STRIPE CERAMIC DRAWER KNOB
22334,DINOSAUR PARTY BAG + STICKER SET
21803,CHRISTMAS TREE STAR DECORATION
84596L,BISCUITS SMALL BOWL LIGHT BLUE
22088,PAPER BUNTING COLOURED LACE
16238,PARTY TIME PENCIL ERASERS
85019A,ROMANTIC IMAGES NOTEBOOK SET
21319,GLASS CHALICE GREEN  SMALL 
84201B,HAPPY BIRTHDAY CARD STRIPEY TEDDY
23274,STAR T-LIGHT HOLDER WILLIE WINKIE
15058C,ICE CREAM DESIGN GARDEN PARASOL
84805A,CREAM CLIMBING HYDRANGA ART FLOWER
22174,PHOTO CUBE
21011,GLITTER SNOW PEAR TREE DECORATION
22447,PIN CUSHION BABUSHKA BLUE
23135,SMALL ZINC HEART WALL ORGANISER
22187,GREEN CHRISTMAS TREE CARD HOLDER
21538,DAIRY MAID  PUDDING BOWL
22152,PLACE SETTING WHITE STAR
22406,MONEY BOX KINGS CHOICE DESIGN
22047,EMPIRE GIFT WRAP
90160C,TURQ+RED BOUDICCA LARGE BRACELET
21620,SET OF 4 ROSE BOTANICAL CANDLES
16202E,BLACK PHOTO ALBUM 
90048,GREEN WITH METAL BAG CHARM
20671,BLUE TEATIME PRINT BOWL 
22133,PINK LOVE HEART SHAPE CUP
17084J,LOVE POTION MASALA INCENSE
21380,WOODEN HAPPY BIRTHDAY GARLAND
90028,NEW BAROQUE LARGE NECKLACE BLK/WHIT
22568,FELTCRAFT CUSHION OWL
21985,PACK OF 12 HEARTS DESIGN TISSUES 
84711B,PINK OVAL SHAPE TRINKET BOX
90072,RUBY DROP CHANDELIER EARRINGS
22269,EGG CUP NATURAL CHICKEN
21109,LARGE CAKE TOWEL CHOCOLATE SPOTS
23079, TOADSTOOL BEDSIDE LIGHT 
90209B,GREEN ENAMEL+GLASS HAIR COMB
22946,WOODEN ADVENT CALENDAR CREAM
21681,GIANT MEDINA STAMPED METAL BOWL 
21209,MULTICOLOUR HONEYCOMB FAN
21682,LARGE MEDINA STAMPED METAL BOWL 
35004G,SET OF 3 GOLD FLYING DUCKS
75049L,LARGE CIRCULAR MIRROR MOBILE
22027,TEA PARTY BIRTHDAY CARD
85230B,CINNAMON SCENTED VOTIVE CANDLE
20846,ZINC HEART LATTICE T-LIGHT HOLDER
23091,METAL HERB GERDEN CONTAINER
23241,TREASURE TIN GYMKHANA DESIGN
47556B,TEA TIME TEA TOWELS 
22164,STRING OF STARS CARD HOLDER
21117,BLOND DOLL DOORSTOP
84563B,BLUE & WHITE BREAKFAST TRAY
21506,"FANCY FONT BIRTHDAY CARD, "
37413,ICON MUG REVOLUTIONARY
23060,HEART BEADED TRELLIS DECORATION
21843,RED RETROSPOT CAKE STAND
84818,DANISH ROSE PHOTO FRAME
22925,BLUE GIANT GARDEN THERMOMETER
90214W,"LETTER 'W'"" BLING KEY RING"""
21868,POTTING SHED TEA MUG
84466,TOP SECRET PEN SET
22033,BOTANICAL ROSE GREETING CARD
22473,TV DINNER TRAY VINTAGE PAISLEY
21429,RED GINGHAM ROSE JEWELLERY BOX
23143,ZINC WIRE KITCHEN ORGANISER
22254,FELT TOADSTOOL LARGE
20733,GOLD MINI TAPE MEASURE 
17136A,BLUE STONES ON WIRE FOR CANDLE
23476,WOODLAND LARGE RED FELT HEART
22795,SWEETHEART RECIPE BOOK STAND
23514,EMBROIDERED RIBBON REEL SALLY 
21272,SALLE DE BAIN HOOK
44234,ASSORTED CIRCULAR MOBILE
46776D,WOVEN SUNSET CUSHION COVER 
21287,SCENTED VELVET LOUNGE CANDLE 
22151,PLACE SETTING WHITE HEART
23565,EGG CUP MILKMAID HELGA 
22941,CHRISTMAS LIGHTS 10 REINDEER
84631,FRUIT TREE AND BIRDS WALL PLAQUE
23562,SET OF 6 RIBBONS PERFECTLY PRETTY  
23373,VINTAGE CHRISTMAS PAPER GIFT BAG
85224,ASSORTED COLOUR SILK GLASSES CASE
20796,SMALL BLUE PROVENCAL CERAMIC BALL
84913B,MINT GREEN ROSE TOWEL
23285,PINK VINTAGE SPOT BEAKER
85180B,PINK HEARTS LIGHT CHAIN 
90177D,DROP DIAMANTE EARRINGS PURPLE
20757,RED DAISY POCKET BOOK 
22476,EMPIRE UNION JACK TV DINNER TRAY
23046,PAPER LANTERN 9 POINT DELUXE STAR
22654,DELUXE SEWING KIT 
90046,WHITE WITH METAL BAG CHARM
22128,PARTY CONES CANDY ASSORTED
21294,ETCHED GLASS COASTER
20983,12 PENCILS TALL TUBE RED RETROSPOT
23125,6PC WOOD PLATE SET DISPOSABLE
23375,50'S CHRISTMAS PAPER GIFT BAG
90212B,JET BLACK LAS VEGAS BRACELET ROUND
23482,PEARLISED IVORY HEART LARGE 
BANK CHARGES,Bank Charges
22067,CHOC TRUFFLE GOLD TRINKET POT 
23208,LUNCH BAG VINTAGE LEAF DESIGN
23172,REGENCY TEA PLATE PINK
71215,METAL BASE FOR CANDLES
23178,JAM CLOCK MAGNET
21637,ASSORTED SANSKRIT MINI NOTEBOOK
84674,FLYING PIG WATERING CAN
22026,BANQUET BIRTHDAY  CARD  
21329,DINOSAURS  WRITING SET 
21677,HEARTS  STICKERS
21467,CHERRY CROCHET FOOD COVER
84712B,PINK JEWELLED PHOTO FRAME
21285,RETROSPOT CANDLE  MEDIUM
22409,MONEY BOX BISCUITS DESIGN
21199,PINK  HEART CONFETTI IN TUBE
21989,PACK OF 20 SKULL PAPER NAPKINS
23096,PETIT TRAY CHIC
90214F,"LETTER 'F'"" BLING KEY RING"""
22618,COOKING SET RETROSPOT
23167,SMALL CERAMIC TOP STORAGE JAR 
84617,NEW BAROQUE BLACK BOXES
23496,PANTRY KITCHEN THERMOMETER 
21986,PACK OF 12 PINK POLKADOT TISSUES
21460,GREEN EASTER EGG HUNT START POST
22614,PACK OF 12 SPACEBOY TISSUES
23390,DOLLY GIRL MINI BACKPACK
46000R,POLYESTER FILLER PAD 45x30cm
22386,JUMBO BAG PINK POLKADOT
90176C,DIAMANTE NECKLACE
22420,LIPSTICK PEN BABY PINK
21785,RAIN PONCHO 
35265,COLOURFUL FLOWER FRUIT BOWL
90100,NECKLACE+BRACELET SET PINK DAISY
22835,HOT WATER BOTTLE I AM SO POORLY
23445,ICE CREAM BUBBLES
22481,BLACK TEA TOWEL CLASSIC DESIGN
22930,BAKING MOULD HEART MILK CHOCOLATE
22746,POPPY'S PLAYHOUSE LIVINGROOM 
84806B,WHITE CANDYSTUFT ARTIFICIAL FLOWER
22921,HERB MARKER CHIVES 
21651,HANGING GLASS ETCHED TEALIGHT
22660,DOORMAT I LOVE LONDON
23545,WRAP RED DOILEY
21556,CERAMIC STRAWBERRY MONEY BOX
21195,PINK  HONEYCOMB PAPER BALL 
90176D,DIAMANTE NECKLACE PURPLE
21159,MOODY BOY  DOOR HANGER 
22769,CHALKBOARD KITCHEN ORGANISER
23002,TRAVEL CARD WALLET SKULLS
20836,FRENCH PAISLEY CUSHION COVER
23215,JINGLE BELL HEART ANTIQUE SILVER
22456,NATURAL SLATE CHALKBOARD LARGE 
85016,SET OF 6 VINTAGE NOTELETS KIT
22082,RIBBON REEL STRIPES DESIGN 
21201,TROPICAL  HONEYCOMB PAPER GARLAND 
23421,PANTRY HOOK SPATULA
23126,DOLLCRAFT GIRL AMELIE
22740,POLKADOT PEN
23123,COCKTAIL SWORDS 50 PIECES
18097C,WHITE TALL PORCELAIN T-LIGHT HOLDER
90018A,SILVER M.O.P ORBIT DROP EARRINGS
23084,RABBIT NIGHT LIGHT
84968F,SET OF 16 VINTAGE SKY BLUE CUTLERY
22512,DOORSTOP RACING CAR DESIGN
23322,LARGE WHITE HEART OF WICKER
23525,BUFFALO BILL WALL ART 
21894,POTTING SHED SEED ENVELOPES
21808,"CHRISTMAS GARLAND STARS,TREES"
23092,LARGE ANTIQUE WHITE PHOTO FRAME
21619,4 VANILLA BOTANICAL CANDLES
23250,ENAMEL BOWL PANTRY
21756,BATH BUILDING BLOCK WORD
22540,MINI JIGSAW CIRCUS PARADE 
22538,MINI JIGSAW GO TO THE FAIR
22316,200 BENDY SKULL STRAWS
23311,VINTAGE CHRISTMAS STOCKING 
16169N,WRAP BLUE RUSSIAN FOLKART
22272,FELTCRAFT DOLL MARIA
90174,BUTTERFLY HAIR BAND
22256,FELT FARM ANIMAL CHICKEN
23422,PANTRY HOOK BALLOON WHISK 
85017C,ENVELOPE 50 CURIOUS IMAGES
85034B,3 WHITE CHOC MORRIS BOXED CANDLES
84984B,RED PEONY CUSHION COVER 
85206B,PINK FELT EASTER EGG BASKET
71495A,CD WALL TIDY BLUE OFFICE
90129F,RED GLASS TASSLE BAG CHARM
22169,FAMILY ALBUM WHITE PICTURE FRAME
22257,FELT FARM ANIMAL SHEEP
21187,WHITE BELL HONEYCOMB PAPER GARLAND 
22396,MAGNETS PACK OF 4 RETRO PHOTO
23019,SMALL APOTHECARY MEASURING JAR 
23165,LARGE CERAMIC TOP STORAGE JAR
21359,RELAX LARGE WOOD LETTERS
84691,PACK 20 DOLLY PEGS
47570B,TEA TIME TABLE CLOTH
22198,LARGE POPCORN HOLDER 
84661A,WHITE SQUARE TABLE CLOCK
22244,3 HOOK HANGER MAGIC GARDEN
85107,CUT GLASS T-LIGHT HOLDER OCTAGON
22428,ENAMEL FIRE BUCKET CREAM
21458,2 PICTURE BOOK EGGS EASTER BUNNY
22704,WRAP RED APPLES 
90176E,DIAMANTE NECKLACE GREEN
23086,ZINC  STAR T-LIGHT HOLDER 
84926E,FLOWERS TILE COASTER
84836,ZINC METAL HEART DECORATION
84927D,LA PALMIERA TILE HOOK
85049F,BABY BOOM RIBBONS 
22117,METAL SIGN HER DINNER IS SERVED 
21479,WHITE SKULL HOT WATER BOTTLE 
21066,VINTAGE RED MUG
23159,SET OF 5 PANCAKE DAY MAGNETS
22606,WOODEN SKITTLES GARDEN SET
23522,DOG AND BALL WALL ART
90065B,BLACK VINT ART DEC CRYSTAL BRACELET
90177B,DROP DIAMANTE EARRINGS BLACK DIAMON
22936,BAKING MOULD ROSE WHITE CHOCOLATE
21723,ALPHABET HEARTS STICKER SHEET
21558,SKULL LUNCH BOX WITH CUTLERY 
20711,JUMBO BAG TOYS 
21397,BLUE POLKADOT EGG CUP 
22662,LUNCH BAG DOLLY GIRL DESIGN
84536B,FAIRY CAKES NOTEBOOK A7 SIZE
72127,COLUMBIAN CANDLE ROUND 
35964,FOLKART CLIP ON STARS
22135,LADLE LOVE HEART PINK
23456,MEDIUM PARLOUR FRAME 
21381,MINI WOODEN HAPPY BIRTHDAY GARLAND
47310M,SMALL POP BOX FUNKY MONKEY
90147,CHUNKY SILVER NECKLACE PASTEL FLOWE
35914,PINK CHICK EGG WARMER + EGG CUP
22063,CERAMIC BOWL WITH STRAWBERRY DESIGN
21497,FANCY FONTS BIRTHDAY WRAP
21631,HIPPY CHIC DECORATIVE PARASOL
23068,ALUMINIUM HEART
23190,BUNDLE OF 3 SCHOOL EXERCISE BOOKS  
16169E,WRAP 50'S  CHRISTMAS
22038,BOTANICAL LAVENDER GIFT WRAP 
22596,CHRISTMAS STAR WISH LIST CHALKBOARD
22145,CHRISTMAS CRAFT HEART STOCKING 
79157B,UBO-LIGHT TRIOBASE BLUE
23353,6 GIFT TAGS VINTAGE CHRISTMAS 
23467,VINTAGE ZINC PLANTER  
22583,PACK OF 6 HANDBAG GIFT BOXES
37475,SET/4 COLOURFUL MIXING BOWLS
90202D,PINK ENAMEL FLOWER HAIR TIE
35910B,PINK FLOWERS RABBIT EASTER
20903,VINTAGE KEEPSAKE BOX TRAVELOGUE
23055,IVORY CHANDELIER T-LIGHT HOLDER
23228,FILIGREE HEART BIRD WHITE 
22278,OVERNIGHT BAG VINTAGE ROSE PAISLEY
23309,SET OF 60 I LOVE LONDON CAKE CASES 
21661,VINTAGE GLASS TEA CADDY
22241,GARLAND WOODEN HAPPY EASTER
84508B,STRIPES DESIGN TEDDY
10135,COLOURING PENCILS BROWN TUBE
85032D,YULETIDE IMAGES GIFT WRAP SET
90194,SILVER LARIAT BLACK STONE EARRINGS
85170D,SET/6 PINK BIRD T-LIGHT CANDLES
21238,RED RETROSPOT CUP
21253,SET OF PICTURE FRAME  STICKERS
84596E,SMALL LICORICE DES PINK BOWL
90030A,SPOTTED WHITE NATURAL SEED NECKLACE
23029,DOORKNOB CRACKED GLAZE GREEN
71403,"PINK/WHITE 'KEEP CLEAN'"" BULLET BIN"""
82582,AREA PATROLLED METAL SIGN
90076,MONTANA DIAMOND CLUSTER EARRINGS
22114,HOT WATER BOTTLE TEA AND SYMPATHY
72051S,BAG OF SILVER STONES
22892,SET OF SALT AND PEPPER TOADSTOOLS
84247L,FAWN AND MUSHROOM GREETING CARD
71053,WHITE METAL LANTERN
22295,HEART FILIGREE DOVE LARGE
84569D,PACK 6 HEART/ICE-CREAM PATCHES
90118,PINK DAISY BAG CHARM
90183A,AMBER DROP EARRINGS W LONG BEADS
47481,50CM METAL STRING WITH  7 CLIPS
22028,PENNY FARTHING BIRTHDAY CARD
72225C,LAVENDER SCENT CAKE CANDLE
