stock_code,description
90125C,TURQUOISE BERTIE GLASS BEAD CHARM
10124A,SPOTS ON RED BOOKCOVER TAPE
20794,BLUE  TILE HOOK
35599D,PINK AND WHITE CHRISTMAS TREE 120CM
90180B,PURPLE AMETHYST NECKLACE W TASSEL
23075,DOUBLE CERAMIC PARLOUR HOOK
84872A,TEATIME FUNKY FLOWER BACKPACK FOR 2
72807C,SET/3 VANILLA SCENTED CANDLE IN BOX
20666,ECONOMY HOLIDAY PURSE
20906,VINTAGE NOTEBOOK BEAUTY GIRL
21324,HANGING MEDINA LANTERN SMALL
23081,GREEN METAL BOX ARMY SUPPLIES
90182C,BLACK 3 BEAD DROP EARRINGS
21807,WHITE CHRISTMAS STAR DECORATION
23043,PAPER LANTERN 9 POINT HOLLY STAR 40
22219,LOVEBIRD HANGING DECORATION WHITE 
23007, SPACEBOY BABY GIFT SET
22491,PACK OF 12 COLOURED PENCILS
23461,SWEETHEART BIRD HOUSE
70007,HI TEC ALPINE HAND WARMER
23470,CARD HOLDER LOVE BIRD LARGE 
84016,FLAG OF ST GEORGE CAR FLAG
22131,FOOD CONTAINER SET 3 LOVE HEART 
90123A,PINK HEART OF GLASS BRACELET
21811,CHRISTMAS HANGING HEART WITH BELL
84251C,"GREETING CARD, TWO SISTERS."
23568,EGG CUP HENRIETTA HEN CREAM 
85231G,ORANGE SCENTED SET/9 T-LIGHTS
35650,VINTAGE BEAD PINK JEWEL STAND
47580,TEA TIME DES TEA COSY
21417,COCKLE SHELL DISH
23270,SET OF 2 CERAMIC PAINTED HEARTS 
22308,TEA COSY BLUE STRIPE
23140,TRIPLE WIRE HOOK IVORY HEART
90084,PINK CRYSTAL GUITAR PHONE CHARM
21163,DO NOT TOUCH MY STUFF DOOR HANGER 
84661C,PINK SQUARE TABLE CLOCK
22853,CAT BOWL VINTAGE CREAM
51014C,"FEATHER PEN,COAL BLACK"
23598,PAPER BUNTING VINTAGE PARTY
37489A,YELLOW/PINK FLOWER DESIGN BIG MUG
22744,MAKE YOUR OWN MONSOON CARD KIT
21275,ZINC TOP  2 DOOR WOODEN SHELF 
23406,HOME SWEET HOME KEY HOLDER
79066K,RETRO MOD TRAY
47599A,PINK PARTY BAGS
22605,WOODEN CROQUET GARDEN SET
23560,SET OF 6 RIBBONS COUNTRY STYLE
23101,SILVER STARS TABLE DECORATION
47567B,TEA TIME KITCHEN APRON
79302M,"ART LIGHTS,FUNK MONKEY"
85015,SET OF 12  VINTAGE POSTCARD SET
21090,SET/6 COLLAGE PAPER PLATES
81952V,ROUND PURPLE CLOCK WITH SUCKER
90176B,DIAMANTE NECKLACE BLACK 
79406,FROSTED WHITE BASE 
22778,GLASS BELL JAR SMALL
84924A,WAKE UP COCKEREL CALENDAR SIGN 
22398,MAGNETS PACK OF 4 SWALLOWS
23028,DOORKNOB CRACKED GLAZE BLUE
22048,BIRTHDAY BANQUET GIFT WRAP
47013A,WINE BOTTLE DRESSING LT.BLUE
90177C,DROP DIAMANTE EARRINGS CRYSTAL
84551,CROCHET DOG KEYRING
84992,72 SWEETHEART FAIRY CAKE CASES
21198,WHITE HEART CONFETTI IN TUBE
23037,CANDLE HOLDER SILVER MADELINE
84584,PINK GINGHAM CAT WITH SCARF
79191C,RETRO PLASTIC ELEPHANT TRAY
84279B,CHERRY BLOSSOM DECORATIVE FLASK
22416,SET OF 36 DOILIES SPACEBOY DESIGN 
22450,SILK PURSE BABUSHKA BLUE
23054,RECYCLED ACAPULCO MAT LAVENDER
35933,PINK STOCKING CHRISTMAS DECORATION
17028J,INCENSE BAZAAR PEACH
15056N,EDWARDIAN PARASOL NATURAL
85064,CREAM SWEETHEART LETTER RACK
18094C,WHITE AND BLUE CERAMIC OIL BURNER
46776A,WOVEN BUBBLE GUM CUSHION COVER
79063D,"RETRO PILL BOX , REVOLUTIONARY"
23307,SET OF 60 PANTRY DESIGN CAKE CASES 
21033,JUMBO BAG CHARLIE AND LOLA TOYS
21678,PAISLEY PATTERN  STICKERS
22046,TEA PARTY  WRAPPING PAPER 
90176A,CLASSIC DIAMANTE NECKLACE JET
90104,PURPLE FRANGIPANI HAIRCLIP
21188,3D HEARTS  HONEYCOMB PAPER GARLAND
22572,ROCKING HORSE GREEN CHRISTMAS 
22961,JAM MAKING SET PRINTED
35953,FOLKART STAR CHRISTMAS DECORATIONS
21738,COSY SLIPPER SHOES SMALL  RED 
85027L,FRENCH CHATEAU LARGE PLATTER 
23227,FILIGREE HEART BUTTERFLY WHITE 
16010,FOLDING CAMPING SCISSOR W/KNIF & S
23291,DOLLY GIRL CHILDRENS CUP
17012B,ORIGAMI JASMINE INCENSE/CANDLE SET
21841,BABY MOUSE RED GINGHAM DRESS
22495,SET OF 2 ROUND TINS CAMEMBERT 
23531,WALL ART BIG LOVE 
84927E,FLOWERS TILE HOOK
37479P,CUBIC MUG FLOCK PINK ON BROWN
22170,PICTURE FRAME WOOD TRIPLE PORTRAIT
47579,TEA TIME BREAKFAST BASKET
22457,NATURAL SLATE HEART CHALKBOARD 
22982,PANTRY PASTRY BRUSH
79337,BLUE FLOCK GLASS CANDLEHOLDER
85088,CANDY SPOT HAND BAG
84819,DANISH ROSE ROUND SEWING BOX
23472, NINE DRAWER OFFICE TIDY
85089,CANDY SPOT BUNNY
44089C,LILAC GAUZE BUTTERFLY LAMPSHADE
90179C,BLACK FINE BEAD NECKLACE W TASSEL
22857,ASSORTED EASTER GIFT TAGS
20966,SANDWICH BATH SPONGE
22380,TOY TIDY SPACEBOY  
23032,DOORKNOB CRACKED GLAZE IVORY
79160,HEART SHAPE WIRELESS DOORBELL
85049G,CHOCOLATE BOX RIBBONS 
84912A,PINK ROSE WASHBAG
23350,ROLL WRAP VINTAGE SPOT 
85019C,CURIOUS  IMAGES NOTEBOOK SET
23493,VINTAGE DOILY TRAVEL SEWING KIT
21654,RIDGED GLASS FINGER BOWL
20866,BLUE ROSE FABRIC MIRROR
37423,WHITE WITH BLACK CATS PLATE
22425,ENAMEL COLANDER CREAM
21041,RED RETROSPOT OVEN GLOVE DOUBLE
90051,CRACKED GLAZE NECKLACE RED
22573,STAR WOODEN CHRISTMAS DECORATION
20781,GOLD EAR MUFF HEADPHONES
21616,4 PEAR BOTANICAL DINNER CANDLES
85032A,ROMANTIC IMAGES GIFT WRAP SET
22619,SET OF 6 SOLDIER SKITTLES
22915,ASSORTED BOTTLE TOP  MAGNETS 
84913A,SOFT PINK ROSE TOWEL 
22210,WOOD STAMP SET BEST WISHES
47589,CONGRATULATIONS BUNTING
84976,RECTANGULAR SHAPED MIRROR
17165D,ASS COL LARGE SAND FROG P'WEIGHT
21481,FAWN BLUE HOT WATER BOTTLE
20653,CHERRY BLOSSOM LUGGAGE TAG
23231,WRAP  VINTAGE DOILEY 
23583,LUNCH BAG PAISLEY PARK  
23523,TREASURE AHOY WALL ART
22271,FELTCRAFT DOLL ROSIE
84510C,SET OF 4 POLKADOT COASTERS
23370,SET 36 COLOUR PENCILS DOILEY
21693,SMALL HAMMERED SILVER CANDLEPOT 
23024,LARGE BONNE JAM JAR  T-LIGHT HOLDER
23355,HOT WATER BOTTLE KEEP CALM
72802C,VANILLA SCENT CANDLE JEWELLED BOX
46000U,POLYESTER FILLER PAD 30CMx30CM
85213,MINI  ZINC GARDEN DECORATIONS 
21025,SPACE FROG
23080,RED METAL BOX TOP SECRET
21927,BLUE/CREAM STRIPE CUSHION COVER 
62018,SOMBRERO 
71477,COLOUR GLASS. STAR T-LIGHT HOLDER
44092C,PURPLE/COPPER HANGING LAMPSHADE
22513,DOORSTOP FOOTBALL DESIGN
10125,MINI FUNKY DESIGN TAPES
22307,GOLD MUG BONE CHINA TREE OF LIFE
22879,NUMBER TILE VINTAGE FONT 0
21527,RED RETROSPOT TRADITIONAL TEAPOT 
23254,CHILDRENS CUTLERY DOLLY GIRL 
22116,METAL SIGN HIS DINNER IS SERVED
90125B,AQUA BERTIE GLASS BEAD BAG CHARM
23418,LAVENDER TOILETTE BOTTLE
20780,BLACK EAR MUFF HEADPHONES
84907,PINK YELLOW PATCH CUSHION COVER
23297,SET 40 HEART SHAPE PETIT FOUR CASES
85170B,SET/6 BLACK BIRD T-LIGHT CANDLES
23513,EMBROIDERED RIBBON REEL SUSIE 
23471,SIX DRAWER OFFICE TIDY
90197B,BLACK GLASS BRACELET W HEART CHARMS
85034A,3 GARDENIA MORRIS BOXED CANDLES
22083,PAPER CHAIN KIT RETROSPOT
22492,MINI PAINT SET VINTAGE 
84531B,BLUE KNITTED EGG COSY
23021,GLASS BONNE JAM JAR
23157,SET OF 6 NATIVITY MAGNETS 
22882,NUMBER TILE VINTAGE FONT 3
23026,DRAWER KNOB VINTAGE GLASS STAR
22281,EASTER TREE YELLOW BIRDS
21705,BAG 500g SWIRLY MARBLES
21588,RETROSPOT GIANT TUBE MATCHES
84663A,GRASS HOPPER WOODEN WALL CLOCK 
90164A,PINK ROSEBUD PEARL BRACELET
22633,HAND WARMER UNION JACK
10124G,ARMY CAMO BOOKCOVER TAPE
90040C,MURANO STYLE GLASS BRACELET GOLD
16169K,WRAP FOLK ART
21673,WHITE SPOT BLUE CERAMIC DRAWER KNOB
20980,36 PENCILS TUBE POSY
21623,VINTAGE UNION JACK MEMOBOARD
23507,MINI PLAYING CARDS BUFFALO BILL 
21692,SILVER LATTICE VANILLA CANDLE POT
21711,FOLDING UMBRELLA WHITE/RED POLKADOT
21720,CAKE SHOP  STICKER SHEET
85189,HANGING BUTTERFLY  EGG
90185B,AMETHYST DIAMANTE EXPANDABLE RING
21245,GREEN POLKADOT PLATE 
79157V,UBO-LIGHT TRIOBASE PURPLE
72816,SET/3 CHRISTMAS DECOUPAGE CANDLES
23251,ENAMEL MUG PANTRY
23064,CINDERELLA CHANDELIER 
23005,TRAVEL CARD WALLET I LOVE LONDON
22357,KINGS CHOICE BISCUIT TIN
35607A,PINK FLUFFY CHRISTMAS DECORATION
21530,DAIRY MAID TOASTRACK
90214O,"LETTER 'O'"" BLING KEY RING"""
22093,MOTORING TISSUE BOX
23153,ZINC SWEETHEART WIRE LETTER RACK
90167,BEADED LOVE HEART JEWELLERY SET
37482P,CUBIC MUG PINK POLKADOT
21936,RED RETROSPOT PICNIC BAG
22243,5 HOOK HANGER RED MAGIC TOADSTOOL
84689,S/2 BEACH HUT TREASURE CHESTS
35818P,"ACRYLIC JEWEL ICICLE, PINK"
17164B,ASS COL SMALL SAND GECKO P'WEIGHT
22129,PARTY CONES CANDY DECORATION
22228,BUNNY WOODEN PAINTED WITH BIRD 
23112,PARISIENNE CURIO CABINET
72821,CUPID SCENTED CANDLE IN GLASS
23039,T-LIGHT HOLDER SILVER HEART HANDLE
21371,MIRRORED WALL ART POPPIES
85146,JARDIN ETCHED GLASS SMALL BELL JAR
21667,GLASS CAKE COVER AND PLATE
23549,WRAP BIRD GARDEN 
37487B,YELLOW/ORANGE FLOWER DESIGN PLATE
23313,VINTAGE CHRISTMAS BUNTING
16206B,RED PURSE WITH PINK HEART
22030,SWALLOWS GREETING CARD
15044B,BLUE PAPER PARASOL 
82616C,MIDNIGHT GLAMOUR SCARF KNITTING KIT
84773,RED ROSE AND LACE C/COVER
84858C,PINK RIVIERA HANDBAG
23070,EDWARDIAN HEART PHOTO FRAME
16045,POPART WOODEN PENCILS ASST
22349,DOG BOWL CHASING BALL DESIGN
21065,BOOM BOX SPEAKER GIRLS
35443,RASTA IN BATH W SPLIFF ASHTRAY
21289,LARGE STRIPES CHOCOLATE GIFT BAG
20731,POSY CANDY BAG
85018D,YULETIDE IMAGES S/6 PAPER BOXES
22691,DOORMAT WELCOME SUNRISE
84665,SQUARE CHERRY BLOSSOM CABINET
90141D,ROSE PENDANT TRIPLE SHELL NECKLACE
22638,SET OF 4 NAPKIN CHARMS CROWNS 
22072,RED RETROSPOT TEA CUP AND SAUCER 
21220,SET/4 BADGES DOGS
23382,BOX OF 6 CHRISTMAS CAKE DECORATIONS
22831,WHITE BROCANTE SOAP DISH
90108,BLUE BLOSSOM HAIR CLIP
23490,T-LIGHT HOLDER HANGING LOVE BIRD
23042,PAPER LANTERN 7 POINT SNOW STAR
21704,BAG 250g SWIRLY MARBLES
20985,HEART CALCULATOR
23323,WHITE WICKER STAR 
23033,DRAWER KNOB CERAMIC RED
22478,BIRDHOUSE GARDEN MARKER 
22408,MONEY BOX CONFECTIONERY DESIGN
22798,ANTIQUE GLASS DRESSING TABLE POT
90214G,"LETTER 'G'"" BLING KEY RING"""
22194,BLACK DINER WALL CLOCK
21794,CLASSIC FRENCH STYLE BASKET NATURAL
16015,MEDIUM CHINESE STYLE SCISSOR
90201D,GREEN ENAMEL FLOWER RING
22266,EASTER DECORATION HANGING BUNNY
47578A,ENGLISH ROSE SMALL SCENTED FLOWER
21898,POTTING SHED ROSE CANDLE
84661B,BLACK SQUARE TABLE CLOCK
22050,PINK PAISLEY ROSE GIFT WRAP
22647,CERAMIC LOVE HEART MONEY BANK
22844,VINTAGE CREAM DOG FOOD CONTAINER
22613,PACK OF 20 SPACEBOY NAPKINS
35819P,"ACRYLIC HANGING JEWEL,PINK"
22781,GUMBALL MAGAZINE RACK
35916B,BLUE FELT HANGING HEART WITH FLOWER
22074,6 RIBBONS SHIMMERING PINKS 
22393,PAPERWEIGHT VINTAGE COLLAGE
22960,JAM MAKING SET WITH JARS
35809B,ENAMEL BLUE RIM TEA CONTAINER
22969,HOMEMADE JAM SCENTED CANDLES
15058A,BLUE POLKADOT GARDEN PARASOL
22849,BREAD BIN DINER STYLE MINT
22515,CHILDS GARDEN SPADE PINK
22232,JIGSAW TOADSTOOLS 3 PIECE
21564,PINK  HEART SHAPE LOVE BUCKET 
22717,CARD DOG AND BALL 
72128,COLUMBIAN CANDLE ROUND
35648,VINTAGE BEAD PINK PURSE 
90175A,WHITE GLASS CHUNKY CHARM BRACELET
90014A,SILVER M.O.P. ORBIT NECKLACE
22191,IVORY DINER WALL CLOCK
23529,DOLLY GIRL WALL ART
20752,BLUE POLKADOT WASHING UP GLOVES
23162,REGENCY TEA STRAINER
22556,PLASTERS IN TIN CIRCUS PARADE 
72811,SMALL ZINC/GLASS CANDLEHOLDER
90035A,"PEARL & SHELL 42'NECKL. GREEN"""
20657,TROPICAL LUGGAGE TAG
21226,POCKET MIRROR WOODLAND
90162A,ANT SILVER TURQUOISE BOUDICCA RING
90205C,LARGE CRYSTAL DIAMANTE HAIRSLIDE
90014B,GOLD M PEARL  ORBIT NECKLACE
21614,SET OF 12 ROSE BOTANICAL T-LIGHTS
22594,CHRISTMAS GINGHAM TREE
21439,BASKET OF TOADSTOOLS
22948,METAL DECORATION NAUGHTY CHILDREN 
22780,LIGHT GARLAND BUTTERFILES PINK
84931A,PINK SCOTTIE DOG W FLOWER PATTERN
46000S,POLYESTER FILLER PAD 40x40cm
21043,APRON MODERN VINTAGE COTTON
35597A,DUSTY PINK CHRISTMAS TREE 30CM
90070,RUBY GLASS CLUSTER BRACELET
21326,AGED GLASS SILVER T-LIGHT HOLDER
90177E,DROP DIAMANTE EARRINGS GREEN
21354,TOAST ITS - BEST MUM
85031B,BLOSSOM IMAGES SCRAP BOOK SET
22604,SET OF 4 NAPKIN CHARMS CUTLERY
22932,BAKING MOULD TOFFEE CUP  CHOCOLATE
22340,NOEL GARLAND PAINTED ZINC 
35651,VINTAGE BEAD PINK SCARF 
23556,LANDMARK FRAME COVENT GARDEN 
72817,SET OF 2 CHRISTMAS DECOUPAGE CANDLE
23214,BELL HEART ANTIQUE GOLD
22289,HANGING METAL CHICKEN DECORATION
22709,WRAP WEDDING DAY
35954,SMALL FOLKART STAR CHRISTMAS DEC
22195,LARGE HEART MEASURING SPOONS
90152B,BLUE/GREEN SHELL NECKLACE W PENDANT
23040,PAPER LANTERN 9 POINT SNOW STAR
22132,RED LOVE HEART SHAPE CUP
21671,RED SPOT CERAMIC DRAWER KNOB
84744,S/6 SEW ON CROCHET FLOWERS
84827,ASS DES PHONE SPONGE CRAFT STICKER
84508A,CAMOUFLAGE DESIGN TEDDY
22689,DOORMAT MERRY CHRISTMAS RED 
84870C,GREEN GEISHA GIRL 
20681,PINK POLKADOT CHILDRENS UMBRELLA
85195,HANGING HEART BASKET
21000,ROSE DU SUD COSMETICS BAG
20685,DOORMAT RED RETROSPOT
84629,WHITE 3 FRAME BIRDS AND TREE 
90186A,AMETHYST HOOP EARRING FLORAL LEAF
22808,SET OF 6 T-LIGHTS EASTER CHICKS
21191,LARGE WHITE HONEYCOMB PAPER BELL  
22764,"RUSTIC WOODEN CABINET, GLASS DOORS"
23332,IVORY WICKER HEART LARGE
20679,EDWARDIAN PARASOL RED
22985,WRAP BILLBOARD FONTS DESIGN
21448,12 DAISY PEGS IN WOOD BOX
22514,CHILDS GARDEN SPADE BLUE
22089,PAPER BUNTING VINTAGE PAISLEY
23354,6 GIFT TAGS 50'S CHRISTMAS 
22829,SWEETHEART WIRE WALL TIDY
21929,JUMBO BAG PINK VINTAGE PAISLEY
35095A,BLUE VICTORIAN FABRIC OVAL BOX
22458,CAST IRON HOOK GARDEN FORK
22268,DECORATION SITTING BUNNY
22052,VINTAGE CARAVAN GIFT WRAP
23537,I LOVE LONDON WALL ART
90123D,WHITE HEART OF GLASS BRACELET
22165,"DIAMANTE HEART SHAPED WALL MIRROR, "
22615,PACK OF 12 CIRCUS PARADE TISSUES 
22277,COSMETIC BAG VINTAGE ROSE PAISLEY
23342,MINT DINER CLOCK
22575,METAL MERRY CHRISTMAS WREATH
22060,LARGE CAKE STAND HANGING HEARTS
15044D,RED PAPER PARASOL
22372,AIRLINE BAG VINTAGE WORLD CHAMPION 
22890,NOVELTY BISCUITS CAKE STAND 3 TIER
84963B,BLUE PAINTED KASHMIRI CHAIR
21281,VINTAGE KITCHEN PRINT SEAFOOD
22760,"TRAY, BREAKFAST IN BED"
22251,BIRDHOUSE DECORATION MAGIC GARDEN
22378,WALL TIDY RETROSPOT 
21213,PACK OF 72 SKULL CAKE CASES
22623,BOX OF VINTAGE JIGSAW BLOCKS 
22446,PIN CUSHION BABUSHKA PINK
23108,SET OF 10 LED DOLLY LIGHTS
21264,WHITE GOOSE FEATHER TREE 60CM 
21726,MULTI HEARTS  STICKERS
75013B,"STRING OF 8 BUTTERFLIES,PINK"
21398,RED POLKADOT COFFEE  MUG
84600,NEW BAROQUE JEWELLERY BOX 
23138,SINGLE WIRE HOOK IVORY HEART
85160B,BLACK BIRD GARDEN DESIGN MUG
22830,UTILTY CABINET WITH HOOKS
20622,VIP PASSPORT COVER 
47574B,ENGLISH ROSE SCENTED HANGING HEART
21316,SMALL CHUNKY GLASS ROMAN  BOWL
21098,CHRISTMAS TOILET ROLL
22942,CHRISTMAS LIGHTS 10 SANTAS 
22230,JIGSAW TREE WITH WATERING CAN
22562,MONSTERS STENCIL CRAFT
23223,CHRISTMAS TREE HANGING SILVER 
90059D,DIAMANTE HAIR GRIP PACK/2 PERIDOT
15044A,PINK PAPER PARASOL 
23327,HANGING CLEAR MINI BOTTLE
35598C,WHITE CHRISTMAS TREE 60CM
85131B,BEADED CRYSTAL HEART GREEN ON STICK
22681,FRENCH BLUE METAL DOOR SIGN 6
23440,PAINT YOUR OWN EGGS IN CRATE
23050,RECYCLED ACAPULCO MAT GREEN
23294,SET OF 6 SNACK LOAF BAKING CASES
84313C,ORANGE TV TRAY TABLE 
21064,BOOM BOX SPEAKER BOYS
23575,SNACK TRAY PAISLEY PARK
23213,STAR WREATH DECORATION WITH BELL
23392,SPACEBOY ROCKET LOLLY MAKERS
90016A,SILVER/M.O.P PENDANT ORBIT NECKLACE
22109,FULL ENGLISH BREAKFAST PLATE
90069,RUBY GLASS CLUSTER NECKLACE
22422,TOOTHPASTE TUBE PEN
72232,FENG SHUI PILLAR CANDLE
22331,WOODLAND PARTY BAG + STICKER SET
21284,RETROSPOT CANDLE  SMALL
22051,BLUE SCANDINAVIAN PAISLEY WRAP
85071B,RED CHARLIE+LOLA PERSONAL DOORSIGN
84906,PINK B'FLY C/COVER W BOBBLES
46115B,GREEN POP ART MAO CUSHION COVER 
84952A,CLEAR LOVE BIRD T-LIGHT HOLDER
21617,4 LILY  BOTANICAL DINNER CANDLES
85035A,GARDENIA 3 WICK MORRIS BOXED CANDLE
90214S,"LETTER 'S'"" BLING KEY RING"""
22249,DECORATION WHITE CHICK MAGIC GARDEN
85203,HANGING WOOD AND FELT BUTTERFLY 
84685,BEACH HUT KEY CABINET
90214I,"LETTER 'I'"" BLING KEY RING"""
22023,EMPIRE BIRTHDAY CARD
35610C,WHITE CHRISTMAS FLOCK DROPLET 
85131D,BEADED CRYSTAL HEART PINK ON STICK
22441,GROW YOUR OWN BASIL IN ENAMEL MUG
22150,3 STRIPEY MICE FELTCRAFT
21576,LETS GO SHOPPING COTTON TOTE BAG
90125A,PINK BERTIE GLASS BEAD BAG CHARM
23463,VINTAGE ZINC WATERING CAN
84673B,BLUE FLY SWAT
22819,"BIRTHDAY CARD, RETRO SPOT"
47471,RAINBOW PEGS PHOTO CLIP STRING
15036,ASSORTED COLOURS SILK FAN
22823,CHEST NATURAL WOOD 20 DRAWERS
21801,CHRISTMAS TREE DECORATION WITH BELL
85215,ASSORTED CHEESE FRIDGE MAGNETS
22999,TRAVEL CARD WALLET RETRO PETALS
84755,COLOUR GLASS T-LIGHT HOLDER HANGING
23483,HANGING  BUTTERFLY T-LIGHT HOLDER
21348,PINK SPOTS CHOCOLATE NESTING BOXES 
23253,16 PC CUTLERY SET PANTRY DESIGN
21908,CHOCOLATE THIS WAY METAL SIGN
21344,MOROCCAN BEATEN METAL DISH
35004P,SET OF 3 PINK FLYING DUCKS
16046,TEATIME PEN CASE & PENS
21365,MIRRORED WALL ART STARS
22854,CREAM SWEETHEART EGG HOLDER
21871,SAVE THE PLANET MUG
22765,NEWSPAPER STAND
84876D,BLUE HEART COMPACT MIRROR
20718,RED RETROSPOT SHOPPER BAG
22904,CALENDAR PAPER CUT DESIGN
22951,60 CAKE CASES DOLLY GIRL DESIGN
21420,OYSTER TRINKET BOX
21721,CANDY SHOP  STICKER SHEET
22788,BROCANTE COAT RACK
84029G,KNITTED UNION FLAG HOT WATER BOTTLE
22870,NUMBER TILE COTTAGE GARDEN 2
84031B,CHARLIE LOLA BLUE HOT WATER BOTTLE 
37489B,BLUE/YELLOW FLOWER DESIGN BIG MUG
22280,POCKET BAG PINK PAISELY BROWN SPOT
21609,SET 12 LAVENDER  BOTANICAL T-LIGHTS
23457,LARGE PARLOUR FRAME
21735,TWO DOOR CURIO CABINET
22297,HEART IVORY TRELLIS SMALL
23515,EMBROIDERED RIBBON REEL DAISY 
84247G,"DECOUPAGE,GREETING CARD,"
22236,CAKE STAND 3 TIER MAGIC GARDEN
22142,CHRISTMAS CRAFT WHITE FAIRY 
21822,GLITTER CHRISTMAS TREE WITH BELLS
75172,PAINTED SEA SHELL METAL WINDCHIME
84086C,PINK/PURPLE RETRO RADIO
21469,POLKA DOT RAFFIA FOOD COVER
22934,BAKING MOULD EASTER EGG WHITE CHOC
37471,MULTICOLOUR POLKADOT PLATE
22726,ALARM CLOCK BAKELIKE GREEN
21988,PACK OF 6 SKULL PAPER PLATES
22970,LONDON BUS COFFEE MUG
22581,WOOD STOCKING CHRISTMAS SCANDISPOT
22173,METAL 4 HOOK HANGER FRENCH CHATEAU
23321,SMALL WHITE HEART OF WICKER
23426,METAL SIGN DROP YOUR PANTS
22222,CAKE PLATE LOVEBIRD WHITE
90162D,ANT SILVER PURPLE BOUDICCA RING
48129,DOORMAT TOPIARY
21358,TOAST ITS - HAPPY BIRTHDAY
20686,DOLLY MIXTURE CHILDREN'S UMBRELLA
79026B,"S/4 ICON COASTER,ELVIS LIVES"
90183C,BLACK DROP EARRINGS W LONG BEADS
84912B,GREEN ROSE WASHBAG
21689,SILVER VANILLA  FLOWER CANDLE POT
21980,PACK OF 12 RED RETROSPOT TISSUES 
21906,PHARMACIE FIRST AID TIN
22598,CHRISTMAS MUSICAL ZINC TREE
84725,FREESTYLE CANVAS ART PICTURE
22314,OFFICE MUG WARMER CHOC+BLUE
23474,WOODLAND SMALL BLUE FELT HEART
22737,RIBBON REEL CHRISTMAS PRESENT 
21791,VINTAGE HEADS AND TAILS CARD GAME 
22343,PARTY PIZZA DISH RED RETROSPOT
23498,CLASSIC BICYCLE CLIPS 
84609,TALL ROCOCO CANDLE HOLDER
22282,12 EGG HOUSE PAINTED WOOD
22325,MOBILE VINTAGE HEARTS 
20658,RED RETROSPOT LUGGAGE TAG
90141B,IVORY PENDANT TRIPLE SHELL NECKLACE
90177A,CLASSIC DIAMANTE EARRINGS JET
71270,PHOTO CLIP LINE
90074,BLACK DIAMOND CLUSTER NECKLACE
22842,BISCUIT TIN VINTAGE RED
M,Manual
23077,DOUGHNUT LIP GLOSS 
21784,SHOE SHINE BOX 
21288,STRIPEY CHOCOLATE NESTING BOXES
84077,WORLD WAR 2 GLIDERS ASSTD DESIGNS
23325,RUSTIC STRAWBERRY JAM POT SMALL
21424,WOODLAND STORAGE BOX LARGE 
21212,PACK OF 72 RETROSPOT CAKE CASES
72799E,IVORY PILLAR CANDLE SILVER FLOCK
21054,NURSE'S BAG SOFT TOY
84997D,CHILDRENS CUTLERY POLKADOT PINK
20972,PINK CREAM FELT CRAFT TRINKET BOX 
21421,PORCELAIN ROSE LARGE 
21710,FOLDING UMBRELLA PINKWHITE POLKADOT
22742,MAKE YOUR OWN PLAYTIME CARD KIT
84388,WISE MAN STAR SHAPE EGG PAN
23356,LOVE HOT WATER BOTTLE
21981,PACK OF 12 WOODLAND TISSUES 
47013C,WINE BOTTLE DRESSING DARK BLUE
23394,POSTE FRANCE CUSHION COVER
21591,COSY HOUR CIGAR BOX MATCHES 
21580,RABBIT  DESIGN  COTTON TOTE BAG
84809B,PINK CHRYSANTHEMUMS ART FLOWER
23107,WHITE HEARTS WIRE PLANT POT HOLDER
22719,GUMBALL MONOCHROME COAT RACK
22112,CHOCOLATE HOT WATER BOTTLE
84452,METAL RABBIT LADDER EASTER 
23374,RED SPOT PAPER GIFT BAG
82613C,"METAL SIGN,CUPCAKE SINGLE HOOK"
21832,CHOCOLATE CALCULATOR
79190B,RETRO PLASTIC POLKA TRAY
20982,12 PENCILS TALL TUBE SKULLS
23336,EGG FRYING PAN PINK 
84802B,PURPLE ANEMONE ARTIFICIAL FLOWER
62097B,BLUE STRIPES SHOULDER BAG
23485,BOTANICAL GARDENS WALL CLOCK 
47566,PARTY BUNTING
23056,CRYSTAL CHANDELIER T-LIGHT HOLDER
21787,RAIN PONCHO RETROSPOT
20695,FLORAL BLUE MONSTER
90181A,AMBER GLASS/SHELL/PEARL NECKLACE
22679,FRENCH BLUE METAL DOOR SIGN 4
22763,KEY CABINET MA CAMPAGNE
20772,GARDEN PATH JOURNAL
22832,BROCANTE SHELF WITH HOOKS
22306,SILVER MUG BONE CHINA TREE OF LIFE
21190,PINK HEARTS PAPER GARLAND
84031A,CHARLIE+LOLA RED HOT WATER BOTTLE 
22039,BOTANICAL LILY GIFT WRAP
20785,FUSCHIA RETRO BAR STOOL
10120,DOGGY RUBBER
23202,JUMBO BAG VINTAGE LEAF
62043B,BLUE CHECK BAG W HANDLE 34X20CM
22024,RAINY LADIES BIRTHDAY CARD
16156S,WRAP PINK FAIRY CAKES 
21814,HEART T-LIGHT HOLDER 
22855,FINE WICKER HEART 
22807,SET OF 6 T-LIGHTS TOADSTOOLS
22119,PEACE WOODEN BLOCK LETTERS
85131C,BEADED CRYSTAL HEART BLUE ON STICK
22954,HEN PARTY CORDON BARRIER TAPE
21917,SET 12 KIDS  WHITE CHALK STICKS
23133,LARGE IVORY HEART WALL ORGANISER
90023,FILIGREE DIAMANTE EARRINGS
23413,DECORATIVE VINTAGE COFFEE  BOX
46776F,WOVEN ROSE GARDEN CUSHION COVER 
21523,DOORMAT FANCY FONT HOME SWEET HOME
23025,DRAWER KNOB VINTAGE GLASS BALL
84905,PINK BUTTERFLY CUSHION COVER 
22118,JOY WOODEN BLOCK LETTERS
90192,JADE DROP EARRINGS W FILIGREE
90065A,WHITE VINTAGE CRYSTAL BRACELET
23053,RECYCLED ACAPULCO MAT PINK
23106,ZINC HEARTS PLANT POT HOLDER
79323P,PINK CHERRY LIGHTS
21688,SILVER PLATE CANDLE BOWL SMALL
35597D,PINK/WHITE CHRISTMAS TREE 30CM
22348,TEA BAG PLATE RED RETROSPOT
35911B,PINK/FLOWER RABBIT EGG WARMER 
22480,RED TEA TOWEL CLASSIC DESIGN
22570,FELTCRAFT CUSHION RABBIT
21676,FLOWERS  STICKERS
90096,NECKLACE+BRACELET SET BLUE BLOSSOM
84970S,HANGING HEART ZINC T-LIGHT HOLDER
23397,FOOT STOOL HOME SWEET HOME 
22485,SET OF 2 WOODEN MARKET CRATES
85232D,SET/3 DECOUPAGE STACKING TINS
37489D,PINK/GREEN FLOWER DESIGN BIG MUG
90122C,TURQUOISE CRYSTAL+GLASS BRACELET
21258,VICTORIAN SEWING BOX LARGE
84078A,SET/4 WHITE RETRO STORAGE CUBES 
82605,OLD DOC RUSSEL METAL SIGN
84531A,PINK KNITTED EGG COSY
23414,ZINC BOX SIGN HOME
21279,VINTAGE KITCHEN PRINT FRUITS
22032,BOTANICAL LILY GREETING CARD
22825,DECORATIVE PLANT POT WITH FRIEZE
22079,RIBBON REEL HEARTS DESIGN 
23352,ROLL WRAP 50'S RED CHRISTMAS 
85212,MINI PAINTED GARDEN DECORATION 
21313,GLASS HEART T-LIGHT HOLDER 
22818,CARD CHRISTMAS VILLAGE
20838,FRENCH LATTICE CUSHION COVER 
21145,ANTIQUE GLASS PLACE SETTING
16161G,WRAP BAD HAIR DAY
21498,RED RETROSPOT WRAP 
22791,T-LIGHT GLASS FLUTED ANTIQUE
84598,BOYS ALPHABET IRON ON PATCHES
22407,MONEY BOX FIRST ADE DESIGN
85087,CANDY SPOT CUSHION COVER
22188,BLACK HEART CARD HOLDER
84963A,PINK PAINTED KASHMIRI CHAIR
22871,NUMBER TILE COTTAGE GARDEN 3 
22868,NUMBER TILE COTTAGE GARDEN 0 
22739,RIBBON REEL CHRISTMAS SOCK BAUBLE
22748,POPPY'S PLAYHOUSE KITCHEN
22637,PIGGY BANK RETROSPOT 
85103,SILVER T-LIGHT SETTING
35916C,PINK FELT HANGING HEART W FLOWER
23218,LAUREL STAR ANTIQUE GOLD
22902,TOTE BAG I LOVE LONDON
84509A,SET OF 4 ENGLISH ROSE PLACEMATS
22377,BOTTLE BAG RETROSPOT 
35095B,RED VICTORIAN FABRIC OVAL BOX
22645,CERAMIC HEART FAIRY CAKE MONEY BANK
22113,GREY HEART HOT WATER BOTTLE
35833P,4 PINK FLOCK CHRISTMAS BALLS
23117,POPPY FIELDS CHOPPING BOARD
35637C,PINK STRING CURTAIN WITH POLE
84580,MOUSE TOY WITH PINK T-SHIRT
21221,SET/4 BADGES CUTE CREATURES
85169A,IVORY LOVE BIRD CANDLE
22517,CHILDS GARDEN RAKE PINK
21627,ELEPHANT CARNIVAL POUFFE
90003E,GREEN PAIR HEART HAIR SLIDES
90156,RESIN BRACELET W PASTEL BEADS
85202,HANGING WOOD AND FELT HEART
23664,FLOWER SHOP DESIGN MUG
84415B,BLUE FLOCK CUSHION COVER 
90093,CLEAR CRYSTAL STAR PHONE CHARM
22729,ALARM CLOCK BAKELIKE ORANGE
21416,CLAM SHELL LARGE
90026B,GLASS BEAD HOOP NECKLACE MONTANA
84898F,YELLOW FLOWERS FELT HANDBAG KIT
22186,RED STAR CARD HOLDER
23061,VINTAGE EMBOSSED HEART
23579,SNACK TRAY I LOVE LONDON
22663,JUMBO BAG DOLLY GIRL DESIGN
22069,BROWN  PIRATE TREASURE CHEST 
47469,ASSORTED SHAPES PHOTO CLIP SILVER 
23201,JUMBO BAG ALPHABET
90146,FINE SILVER NECKLACE W PASTEL FLOWE
23359,SET OF 12 T-LIGHTS VINTAGE DOILEY
79062D,"RETRO TIN ASHTRAY,REVOLUTIONARY"
23412,HEART MIRROR ANTIQUE WHITE
90151,SILVER/NATURAL SHELL NECKLACE
22098,BOUDOIR SQUARE TISSUE BOX
35597B,BLACKCHRISTMAS TREE 30CM
35967,FOLK ART METAL STAR T-LIGHT HOLDER
22759,SET OF 3 NOTEBOOKS IN PARCEL
21360,JOY LARGE WOOD LETTERS
21333,CLASSIC WHITE FRAME
90199D,5 STRAND GLASS NECKLACE AMBER
21897,POTTING SHED CANDLE CITRONELLA
37489C,GREEN/BLUE FLOWER DESIGN BIG MUG
18098C,PORCELAIN BUTTERFLY OIL BURNER
22138,BAKING SET 9 PIECE RETROSPOT 
15056BL,EDWARDIAN PARASOL BLACK
21846,PINK DIAMANTE PEN IN GIFT BOX
22707,WRAP MONSTER FUN 
90039C,FIRE POLISHED GLASS BRACELET BLACK
22629,SPACEBOY LUNCH BOX 
22640,SET OF 4 NAPKIN CHARMS 3 KEYS 
35638B,PINK/BLUE STRING CURTAIN 
47504K,ENGLISH ROSE GARDEN SECATEURS
21901,"KEY FOB , BACK DOOR "
22684,FRENCH BLUE METAL DOOR SIGN 9
22335,HEART DECORATION PAINTED ZINC 
90158,ST TROPEZ NECKLACE
23484,HEART TRELLIS TRIPLE T-LIGHT HOLDER
23520,EMBROIDERED RIBBON REEL RUBY 
23265,SET OF 3 WOODEN TREE DECORATIONS
21018,BIRD BOX CHRISTMAS TREE DECORATION
22718,CARD CAT AND TREE 
21820,GLITTER HEART GARLAND WITH BELLS 
90027A,GLASS BEAD HOOP EARRINGS BLACK
PADS,PADS TO MATCH ALL CUSHIONS
84206C,CHAMPAGNE TRAY BLANK CARD
90185C,BLACK DIAMANTE EXPANDABLE RING
23501,KEY RING BASEBALL BOOT UNION JACK
23349,ROLL WRAP VINTAGE CHRISTMAS
90011B,BLACK CRYSTAL DROP EARRINGS
85049E,SCANDINAVIAN REDS RIBBONS
22617,BAKING SET SPACEBOY DESIGN
20861,GOLD COSMETIC BAG PINK STAR
21465,PINK FLOWER CROCHET FOOD COVER
22066,LOVE HEART TRINKET POT
21755,LOVE BUILDING BLOCK WORD
21680,WOODLAND  STICKERS
22097,SWALLOW SQUARE TISSUE BOX
35638A,PINK AND BLACK STRING CURTAIN
22584,PACK OF 6 PANETTONE GIFT BOXES
35916A,YELLOW FELT HANGING HEART W FLOWER
16244B,MAXWELL 2 TONE BLUE 60 PAGE PHOTO A
22096,PINK PAISLEY SQUARE TISSUE BOX 
17011F,ORIGAMI SANDLEWOOD INCENSE+FLOWER
23303,SET 4 PICNIC CUTLERY FONDANT
90161C,ANT COPPER LIME BOUDICCA BRACELET
35646,VINTAGE BEAD PINK EVENING BAG
21471,STRAWBERRY RAFFIA FOOD COVER
22179,SET 10 LIGHTS NIGHT OWL
84847,FLORAL BATHROOM SET
82011C,BATHROOM SCALES FOOTPRINTS IN SAND
90155,RESIN NECKLACE W PASTEL BEADS
