stock_code,description
22738,RIBBON REEL SNOWY VILLAGE
85114B,IVORY ENCHANTED FOREST PLACEMAT
21849,SILVER DIAMANTE PEN IN GIFT BOX
23275,SET OF 3 HANGING OWLS OLLIE BEAK
90133,TEAL/FUSCHIA COL BEAD NECKLACE
21672,WHITE SPOT RED CERAMIC DRAWER KNOB
21976,PACK OF 60 MUSHROOM CAKE CASES
21874,GIN AND TONIC MUG
84879,ASSORTED COLOUR BIRD ORNAMENT
90024B,NEW BAROQUE B'FLY NECKLACE RED
21332,MOROCCAN BEATEN METAL MIRROR
90180A,BLACK+WHITE NECKLACE W TASSEL
22551,PLASTERS IN TIN SPACEBOY
21930,JUMBO STORAGE BAG SKULLS
90202A,PURPLE ENAMEL FLOWER HAIR TIE
90130A,WHITE STONE/CRYSTAL EARRINGS
85096,HILDA CANDY SPOT RABBIT
21991,BOHEMIAN COLLAGE STATIONERY SET
22899,CHILDREN'S APRON DOLLY GIRL 
22727,ALARM CLOCK BAKELIKE RED 
40001,WHITE BAMBOO RIBS LAMPSHADE
84715,SET OF 6 ICE CREAM SKITTLES
72780,BLACK SILOUETTE CANDLE PLATE
20828,GLITTER BUTTERFLY CLIPS
84658,WHITE STITCHED CUSHION COVER
85036B,CHOCOLATE 1 WICK MORRIS BOX CANDLE
22949,36 DOILIES DOLLY GIRL
90122A,PINK CRYSTAL+GLASS BRACELET
21722,SWEET PUDDING STICKER SHEET
21703,BAG 125g SWIRLY MARBLES
21839,MUMMY MOUSE RED GINGHAM RIBBON
22693,GROW A FLYTRAP OR SUNFLOWER IN TIN
23371,SET 36 COLOUR PENCILS SPACEBOY 
84947,ANTIQUE SILVER TEA GLASS ENGRAVED
20941,FROG CANDLE
90214K,"LETTER 'K'"" BLING KEY RING"""
23083,SET 6 PAPER TABLE LANTERN STARS 
23266,SET OF 3 WOODEN STOCKING DECORATION
22449,SILK PURSE BABUSHKA PINK
84927F,PSYCHEDELIC TILE HOOK
84507C,BLUE CIRCLES DESIGN MONKEY DOLL
22345,PARTY PIZZA DISH BLUE POLKADOT
22554,PLASTERS IN TIN WOODLAND ANIMALS
84804B,BLUE DELPHINIUM ARTIFICIAL FLOWER
22424,ENAMEL BREAD BIN CREAM
21136,PAINTED METAL PEARS ASSORTED
22686,FRENCH BLUE METAL DOOR SIGN No
16052,TEATIME PUSH DOWN RUBBER
22182,CAKE STAND VICTORIAN FILIGREE SMALL
90043,COPPER AND BRASS BAG CHARM
85038,6 CHOCOLATE LOVE HEART T-LIGHTS
17109D,FLOWER FAIRY INCENSE BOUQUET
23506,MINI PLAYING CARDS SPACEBOY 
22734,SET OF 6 RIBBONS VINTAGE CHRISTMAS
21730,GLASS STAR FROSTED T-LIGHT HOLDER
20751,FUNKY WASHING UP GLOVES ASSORTED
35610A,PINK CHRISTMAS FLOCK DROPLET 
85095,THREE CANVAS LUGGAGE TAGS
85049A,TRADITIONAL CHRISTMAS RIBBONS
35607B,BLACK FEATHER CHRISTMAS DECORATION
22874,NUMBER TILE COTTAGE GARDEN 6
21499,BLUE POLKADOT WRAP
21096,SET/6 FRUIT SALAD  PAPER PLATES
23065,LARGE DECO JEWELLERY STAND
35598D,PINK/WHITE CHRISTMAS TREE 60CM
23403,LETTER HOLDER HOME SWEET HOME
21393,BLUE POLKADOT PUDDING BOWL
90129E,PURPLE GLASS TASSLE BAG CHARM
22044,CHRISTMAS CARD STACK OF PRESENTS
21828,EIGHT PIECE SNAKE  SET
23256,CHILDRENS CUTLERY SPACEBOY 
23210,WHITE ROCKING HORSE HAND PAINTED
22292,HANGING CHICK  YELLOW DECORATION
48111,DOORMAT 3 SMILEY CATS
85152,HAND OVER THE CHOCOLATE   SIGN 
22333,RETROSPOT PARTY BAG + STICKER SET
22065,CHRISTMAS PUDDING TRINKET POT 
20677,PINK POLKADOT BOWL
84984A,GREEN PEONY CUSHION COVER
22824,3 TIER SWEETHEART GARDEN SHELF
84406B,CREAM CUPID HEARTS COAT HANGER
21644,ASSORTED TUTTI FRUTTI HEART BOX
23234,BISCUIT TIN VINTAGE CHRISTMAS
21774,DECORATIVE CATS BATHROOM BOTTLE
23569,TRADTIONAL ALPHABET STAMP SET
17084N,FAIRY DREAMS INCENSE 
40003,WHITE BAMBOO RIBS LAMPSHADE
21251,DINOSAUR HEIGHT CHART STICKER SET
21716,BOYS VINTAGE TIN SEASIDE BUCKET
22911,PAPER CHAIN KIT LONDON
22908,PACK OF 20 NAPKINS RED APPLES
84968B,SET OF 16 VINTAGE IVORY CUTLERY
23564,EGG CUP MILKMAID INGRID
23292,SPACE BOY CHILDRENS CUP
90059A,DIAMANTE HAIR GRIP PACK/2 CRYSTAL
23196,LEAVES MAGNETIC  SHOPPING LIST
23312,VINTAGE CHRISTMAS GIFT SACK
90027D,GLASS BEAD HOOP EARRINGS AMETHYST
72798C,SET/4 GARDEN ROSE DINNER CANDLE
82613D,METAL SIGN CUPCAKE SINGLE HOOK
22121,NOEL WOODEN BLOCK LETTERS 
23182,TOILET SIGN OCCUPIED OR VACANT
84843,WHITE SOAP RACK WITH 2 BOTTLES
37449,CERAMIC CAKE STAND + HANGING CAKES
84550,CROCHET LILAC/RED BEAR KEYRING
22938,CUPCAKE LACE PAPER SET 6
22929,SCHOOL DESK AND CHAIR 
22200,FRYING PAN PINK POLKADOT
21205,MULTICOLOUR 3D BALLS GARLAND
84616,SILVER ROCCOCO CHANDELIER
84707A,SILVER JEWELLED MIRROR TRINKET TRAY
85030,FRENCH CHATEAU OVAL PLATTER
22483,RED GINGHAM TEDDY BEAR 
23047,PAPER LANTERN 5 POINT SEQUIN STAR
90036C,"FLOWER GLASS GARLAND NECKL.36'BLUE"""
84975,HEART SHAPED MIRROR
22350,ILLUSTRATED CAT BOWL 
21724,PANDA AND BUNNIES STICKER SHEET
90195B,BLACK GEMSTONE BRACELET
90058B,CRYSTAL STUD EARRINGS ASSORTED COL 
22474,SPACEBOY TV DINNER TRAY
20878,SET/9 CHRISTMAS T-LIGHTS SCENTED 
22505,MEMO BOARD COTTAGE DESIGN
48138,DOORMAT UNION FLAG
23209,LUNCH BAG DOILEY PATTERN 
22296,HEART IVORY TRELLIS LARGE
51020B,STRIPY DESIGN SHOWER CAP
22649,STRAWBERRY FAIRY CAKE TEAPOT
84509E,SET OF 4 CAROUSEL PLACEMATS 
22974,CHILDRENS DOLLY GIRL MUG
23102,SILVER HEARTS TABLE DECORATION
20821,GOLDIE LOOKING MIRROR
21987,PACK OF 6 SKULL PAPER CUPS
22493,PAINT YOUR OWN CANVAS SET
48187,DOORMAT NEW ENGLAND
21544,SKULLS  WATER TRANSFER TATTOOS 
22611,VINTAGE UNION JACK SHOPPING BAG
84925D,LA PALMIERA WALL THERMOMETER
90026D,GLASS BEAD HOOP NECKLACE AMETHYST
16207B,PINK HEART RED HANDBAG
10133,COLOURING PENCILS BROWN TUBE
35909B,PINK FLOWERS RABBIT EASTER
22586,FELTCRAFT HAIRBAND PINK AND BLUE
82095,HEART BUTTONS JEWELLERY BOX
44236,PINK/PURPLE CIRCLE CURTAIN
21818,GLITTER CHRISTMAS HEART 
90042A,FRESHWATER PEARL BRACELET GOLD
23111,PARISIENNE SEWING BOX
23400,SHELF WITH 4 HOOKS HOME SWEET HOME
22064,PINK DOUGHNUT TRINKET POT 
23170,REGENCY TEA PLATE ROSES 
21071,VINTAGE BILLBOARD DRINK ME MUG
DOT,DOTCOM POSTAGE
23378,PACK OF 12 50'S CHRISTMAS TISSUES
22274,FELTCRAFT DOLL EMILY
23221,REINDEER HEART DECORATION SILVER
44089A,PINK GAUZE BUTTERFLY LAMPSHADE
22805,BLUE DRAWER KNOB ACRYLIC EDWARDIAN
20801,LARGE PINK GLASS SUNDAE DISH
21864,UNION JACK FLAG PASSPORT COVER 
10002,INFLATABLE POLITICAL GLOBE 
20664,TROPICAL HOLIDAY PURSE 
22336,DOVE DECORATION PAINTED ZINC 
84686,BEACH HUT MIRROR
22155,STAR DECORATION RUSTIC
84806A,PINK CANDYSTUFT ARTIFICIAL FLOWER
22342,HOME GARLAND PAINTED ZINC 
35961,FOLKART ZINC HEART CHRISTMAS DEC
90001C,ANTIQUE OPAL WHITE FLOWER EARRINGS
79323B,BLACK CHERRY LIGHTS
22299,PIG KEYRING WITH LIGHT & SOUND 
22702,BLACK AND WHITE CAT BOWL
85024B,EAU DE NILE JEWELLED PHOTOFRAME
47016,LIGHT DECORATION BATTERY OPERATED
85132C,CHARLIE AND LOLA FIGURES TINS
22421,LIPSTICK PEN FUSCHIA
22770,MIRROR CORNICE
22994,TRAVEL CARD WALLET RETROSPOT
22229,BUNNY WOODEN PAINTED WITH FLOWER 
23220,REINDEER HEART DECORATION GOLD
22608,PENS ASSORTED FUNKY JEWELED 
46776C,WOVEN FROST CUSHION COVER
22592,CARDHOLDER HOLLY WREATH METAL
23338,EGG FRYING PAN RED 
20986,BLUE CALCULATOR RULER
22777,GLASS BELL JAR LARGE
84562A,PINK/WHITE RIBBED MELAMINE JUG
16012,FOOD/DRINK SPONGE STICKERS
82581,TOILET METAL SIGN
77101A,UNION FLAG WINDSOCK
85045,GREEN CHRISTMAS TREE STRING 20LIGHT
22976,CIRCUS PARADE CHILDRENS EGG CUP 
22609,PENS ASSORTED SPACEBALL
22697,GREEN REGENCY TEACUP AND SAUCER
23031,DOORKNOB CRACKED GLAZE PINK
90013C,GREEN VINTAGE EARRINGS 
21793,CLASSIC FRENCH STYLE BASKET BROWN
20981,12 PENCILS TALL TUBE WOODLAND
82552,WASHROOM METAL SIGN
20712,JUMBO BAG WOODLAND ANIMALS
22862,LOVE HEART NAPKIN BOX 
84766,SILVER ROCOCO CANDLE STICK
22912,YELLOW COAT RACK PARIS FASHION
90130B,TURQ STONE/CRYSTAL EARRINGS
23453,OVAL  MINI PORTRAIT FRAME
90211A,DIAMOND LAS VEGAS NECKLACE 45CM
79329,PINK FLOCK GLASS CANDLEHOLDER
22804,CANDLEHOLDER PINK HANGING HEART
22567,20 DOLLY PEGS RETROSPOT
90036E,"FLOWER GLASS GARLD NECKL36'AMETHYST"""
90050,CRACKED GLAZE NECKLACE IVORY
23041,PAPER LANTERN 6 POINT SNOW STAR
85071D,CHARLIE+LOLA MY ROOM DOOR SIGN
20768,GREEN FERN JOURNAL 
90208,PAIR OF PINK FLOWER CLUSTER SLIDE
37500,TEA TIME TEAPOT IN GIFT BOX
23431,NATURAL HANGING QUILTED HEARTS 
85169C,EAU DE NIL LOVE BIRD CANDLE
20669,RED HEART LUGGAGE TAG
90188,DROP EARRINGS W FLOWER & LEAF
72801C,4 ROSE PINK DINNER CANDLES
23343,JUMBO BAG VINTAGE CHRISTMAS 
21486,PINK HEART DOTS HOT WATER BOTTLE
85028S,FRENCH CHATEAU SMALL FRUITBOWL
21561,DINOSAUR LUNCH BOX WITH CUTLERY
21584,RETROSPOT SMALL TUBE MATCHES
84813,SET OF 4 DIAMOND NAPKIN RINGS
35924,HANGING FAIRY CAKE DECORATION
22163,HEART STRING MEMO HOLDER HANGING
22953,BIRTHDAY BANNER TAPE
90082A,DIAMANTE BOW BROOCH GREEN COLOUR
79191D,RETRO PLASTIC DAISY TRAY
20978,36 PENCILS TUBE SKULLS
21389,IVORY HANGING DECORATION  BIRD
22621,TRADITIONAL KNITTING NANCY
84659A,WHITE TRAVEL ALARM CLOCK
22632,HAND WARMER RED POLKA DOT
23230,WRAP ALPHABET DESIGN
35915C,PEACH KNITTED HEN 
22991,GIRAFFE WOODEN RULER
90169,DAISY HAIR COMB
21634,ASSORTED MINI MADRAS NOTEBOOK
22412,METAL SIGN NEIGHBOURHOOD WITCH 
22216,T-LIGHT HOLDER WHITE LACE
84247E,PACK OF 12 CHRISTMAS FUN CARDS
47593A,CAROUSEL PONIES BABY BIB
79191B,RETRO PLASTIC POLKA TRAY
85232B,SET OF 3 BABUSHKA STACKING TINS
21361,LOVE LARGE WOOD LETTERS 
84882,GREEN WIRE STANDING CANDLE HOLDER
47594A,CAROUSEL DESIGN WASHBAG
23017,APOTHECARY MEASURING JAR
85099C,JUMBO  BAG BAROQUE BLACK WHITE
84279P,CHERRY BLOSSOM  DECORATIVE FLASK
37327,ASSTD MULTICOLOUR CIRCLES MUG
16248B,BLUE HOLE PUNCH
23365,SET 12 COLOUR PENCILS LOVE LONDON
23272,TREE T-LIGHT HOLDER WILLIE WINKIE
22390,PAPERWEIGHT CHILDHOOD MEMORIES
84801B,WHITE HYDRANGEA ART FLOWER
23232,WRAP VINTAGE LEAF DESIGN
21172,PARTY METAL SIGN 
21547,CERAMIC BIRDHOUSE CRESTED TIT SMALL
22147,FELTCRAFT BUTTERFLY HEARTS
21524,DOORMAT SPOTTY HOME SWEET HOME
22322,BIRD DECORATION GREEN POLKADOT
90016B,GOLD/M.O.P PENDANT ORBIT NECKLACE
21928,JUMBO BAG SCANDINAVIAN BLUE PAISLEY
47590A,BLUE HAPPY BIRTHDAY BUNTING
21632,VINTAGE PINK DECORATIVE PARASOL
85040B,SET/4 BLUE FLOWER CANDLES IN BOWL
22980,PANTRY SCRUBBING BRUSH
84846A,SCENTED CANDLE IN DIGITALIS TIN
23401,RUSTIC MIRROR WITH LACE HEART
84306,S/3 PINK SQUARE PLANTERS ROSES
23100,SILVER BELLS TABLE DECORATION
79149B,SILICON STAR BULB  BLUE
22906,12 MESSAGE CARDS WITH ENVELOPES
37488A,YELLOW PINK FLOWER DESIGN BIG BOWL
23048,SET OF 10 LANTERNS FAIRY LIGHT STAR
21106,CREAM SLICE FLANNEL CHOCOLATE SPOT 
22276,WASH BAG VINTAGE ROSE PAISLEY
90190B,GOLD/AMBER DROP EARRINGS W LEAF
90163B,WHITE ROSEBUD & PEARL NECKLACE
22838,3 TIER CAKE TIN RED AND CREAM
22927,GREEN GIANT GARDEN THERMOMETER
23263,SET OF 3 WOODEN HEART DECORATIONS
23527,ANIMALS AND NATURE WALL ART
84997A,CHILDRENS CUTLERY POLKADOT GREEN 
85123A,CREAM HANGING HEART T-LIGHT HOLDER
21222,SET/4 BADGES BEETLES
72800E,4 IVORY DINNER CANDLES SILVER FLOCK
84723,CHERRY BLOSSOM CANVAS ART PICTURE
21925,UNION STRIPE CUSHION COVER 
84575A,PINK DOG CANNISTER
40046A,RED DAISY PAPER LAMPSHADE
22996,TRAVEL CARD WALLET VINTAGE TICKET
84706F,RED PEONY TABLE CLOCK
84595E,LARGE TORTILLA DESIGN RED BOWL
21899,GARAGE KEY FOB
23448,CREAM BUNNY EASTER EGG BASKET
22809,SET OF 6 T-LIGHTS SANTA
20766,GARDEN PATH SKETCHBOOK
21293,MIRRORED DOVE WALL DECORATION
22988,SOLDIERS EGG CUP 
16011,ANIMAL STICKERS
22889,NUMBER TILE VINTAGE FONT No 
90191,SILVER LARIAT 40CM
22318,FIVE HEART HANGING DECORATION
84989A,75 GREEN FAIRY CAKE CASES
16169M,WRAP DAISY CARPET 
20702,PINK PADDED MOBILE
21915,RED  HARMONICA IN BOX 
21993,FLORAL FOLK STATIONERY SET
23015,CORDIAL GLASS JUG
48188,DOORMAT WELCOME PUPPIES
84922,PINK BUTTERFLY WASHBAG
22860,EASTER TIN CHICKS PINK DAISY
47586A,PINK FAIRY CAKE CUSHION COVER
20971,PINK BLUE FELT CRAFT TRINKET BOX
21809,CHRISTMAS HANGING TREE WITH BELL
23222,CHRISTMAS TREE HANGING GOLD
47341B,BLUE TABLE RUN FLOWER
22695,WICKER WREATH SMALL
22828,REGENCY MIRROR WITH SHUTTERS
84951A,SET OF 4 PISTACHIO LOVEBIRD COASTER
84985A,SET OF 72 GREEN PAPER DOILIES
90122B,JADE CRYSTAL+GLASS BRACELET
22736,RIBBON REEL MAKING SNOWMEN 
90013A,MIDNIGHT BLUE VINTAGE EARRINGS
23217,LAUREL HEART ANTIQUE SILVER
20728,LUNCH BAG CARS BLUE
21219,SET/4 BADGES BALLOON GIRL
90101,WHITE FRANGIPANI NECKLACE
21250,SET OF SKULL WALL STICKERS
23197,SKETCHBOOK MAGNETIC SHOPPING LIST
22042,CHRISTMAS CARD SINGING ANGEL
22563,HAPPY STENCIL CRAFT
22021,BLUE FELT EASTER EGG BASKET
20700,GREEN CAT FLORAL CUSHION COVER 
90057,DIAMANTE RING ASSORTED IN BOX.
22328,ROUND SNACK BOXES SET OF 4 FRUITS 
71406C,BLACK ORANGE SQUEEZER
90040B,MURANO STYLE GLASS BRACELET BLACK
37461,FUNKY MONKEY MUG
20996,JAZZ HEARTS ADDRESS BOOK
22261,FELT EGG COSY WHITE RABBIT 
84968C,SET OF 16 VINTAGE PISTACHIO CUTLERY
21208,PASTEL COLOUR HONEYCOMB FAN
21157,RED RETROSPOT WASHBAG
84380,SET OF 3 BUTTERFLY COOKIE CUTTERS
90198B,VINTAGE ROSE BEAD BRACELET BLACK
85014A,BLACK/BLUE POLKADOT UMBRELLA
84950,ASSORTED COLOUR T-LIGHT HOLDER
20802,SMALL GLASS SUNDAE DISH CLEAR
22716,CARD CIRCUS PARADE
90024F,NEW BAROQUE B'FLY NECKLACE CRYSTAL
85032B,BLOSSOM IMAGES GIFT WRAP SET
85188A,GREEN METAL SWINGING BUNNY
90058A,CRYSTAL STUD EARRINGS CLEAR DISPLAY
22531,MAGIC DRAWING SLATE CIRCUS PARADE  
22801,ANTIQUE GLASS PEDESTAL BOWL
84313B,BLUE TV TRAY TABLE 
22544,MINI JIGSAW SPACEBOY
22094,RED RETROSPOT TISSUE BOX
20935,ROUND CACTUS CANDLE
21056,DOCTOR'S BAG SOFT TOY
35909A,RABBIT EASTER DECORATION
90179A,AMBER FINE BEAD NECKLACE W TASSEL
23368,SET 12 COLOUR PENCILS DOLLY GIRL 
22081,RIBBON REEL FLORA + FAUNA 
90031,BILI NUT AND WOOD NECKLACE
84199,GLOW IN DARK DOLPHINS
22909,SET OF 20 VINTAGE CHRISTMAS NAPKINS
22470,HEART OF WICKER LARGE
20777,CHRYSANTHEMUM NOTEBOOK
22964,3 PIECE SPACEBOY COOKIE CUTTER SET
22105,MIRROR MOSAIC GOBLET CANDLE HOLDER
23460,SWEETHEART WALL TIDY 
35957,SMALLFOLKART BAUBLE CHRISTMAS DEC
85204,HANGING WOOD AND FELT FLOWER
35001W,HAND OPEN SHAPE DECO.WHITE
20758,ABSTRACT CIRCLES POCKET BOOK
22712,CARD DOLLY GIRL 
22537,MAGIC DRAWING SLATE DINOSAUR
20961,STRAWBERRY BATH SPONGE 
84876B,GREEN HEART COMPACT MIRROR
23229,DONKEY TAIL GAME 
90141A,GREEN PENDANT TRIPLE SHELL NECKLACE
23186,FRENCH STYLE STORAGE JAR CAFE 
47348A,FUSCHIA VOILE POINTY SHOE DEC
22305,COFFEE MUG PINK PAISLEY DESIGN
21107,CREAM SLICE FLANNEL PINK SPOT 
23369,SET 36 COLOUR PENCILS LOVE LONDON
79336,LIGHT PINK FLOCK GLASS CANDLEHOLDER
23267,SET OF 4 SANTA PLACE SETTINGS
84559B,3D SHEET OF CAT STICKERS
23379,PACK OF 12 RED APPLE TISSUES
23280,FOLDING BUTTERFLY MIRROR HOT PINK 
84688,BEACH HUT DESIGN BLACKBOARD
21461,BLUE EASTER EGG HUNT START POST
22956,36 FOIL HEART CAKE CASES
21518,BANK ACCOUNT  GREETING  CARD 
22123,PING MICROWAVE APRON
85094,CANDY SPOT EGG WARMER RABBIT
85135B,BLUE DRAGONFLY HELICOPTER
22779,WOODEN OWLS LIGHT GARLAND 
23478,WOODLAND LARGE PINK FELT HEART
23555,LANDMARK FRAME NOTTING HILL 
21749,LARGE RED RETROSPOT WINDMILL
84032B,CHARLIE + LOLA RED HOT WATER BOTTLE
21823,PAINTED METAL HEART WITH HOLLY BELL
22436,12 COLOURED PARTY BALLOONS
22461,SAVOY ART DECO CLOCK
72812,LARGE ZINC GLASS CANDLEHOLDER
20703,BLUE PADDED SOFT MOBILE
85028L,FRENCH CHATEAU LARGE FRUIT BOWL 
46000M,POLYESTER FILLER PAD 45x45cm
37342,POLKADOT COFFEE CUP & SAUCER PINK
21035,SET/2 RED RETROSPOT TEA TOWELS 
72801D,4 SKY BLUE DINNER CANDLES
23282,FOLDING BUTTERFLY MIRROR IVORY 
23553,LANDMARK FRAME CAMDEN TOWN 
22166,WALL MIRROR RECTANGLE DIAMANTE PINK
22888,NUMBER TILE VINTAGE FONT 9 
84660C,PINK STITCHED WALL CLOCK
23702,High Resolution Image
21635,MADRAS NOTEBOOK LARGE 
20973,12 PENCIL SMALL TUBE WOODLAND
21454,PAINTED PINK RABBIT 
17084R,ASSORTED INCENSE PACK
21189,WHITE HONEYCOMB PAPER GARLAND 
22963,JAM JAR WITH BLUE LID
90205A,LARGE MINT DIAMANTE HAIRSLIDE
21317,GLASS SPHERE CANDLE STAND MEDIUM
21391,FRENCH LAVENDER SCENT HEART
35972,DAISY FOLKART HEART DECORATION
21376,LARGE  TALL CAMPHOR WOOD TOADSTOOL 
23078,ICE CREAM PEN LIP GLOSS 
23428,IVORY RETRO KITCHEN WALL CLOCK
84683,CLASSICAL ROSE CANDLESTAND
23372,SET 36 COLOUR PENCILS DOLLY GIRL
22733,3D TRADITIONAL CHRISTMAS STICKERS
84971S,SMALL HEART FLOWERS HOOK 
22497,SET OF 2 TINS VINTAGE BATHROOM 
35818B,"ACRYLIC JEWEL ICICLE, BLUE"
22157,ANGEL DECORATION WITH LACE PADDED
22171,3 HOOK PHOTO SHELF ANTIQUE WHITE
23425,STORAGE TIN HOME SWEET HOME
22559,SEASIDE FLYING DISC
23286,BLUE VINTAGE SPOT BEAKER
21231,SWEETHEART CERAMIC TRINKET BOX
21086,SET/6 RED SPOTTY PAPER CUPS
22935,BAKING MOULD ROSE MILK CHOCOLATE
22653,BUTTON BOX 
21872,GLAMOROUS  MUG
22775,PURPLE DRAWERKNOB ACRYLIC EDWARDIAN
16054,POPART RECT PENCIL SHARPENER ASST
20665,RED RETROSPOT PURSE 
21262,WHITE GOOSE FEATHER CHRISTMAS TREE 
90162B,ANT SILVER LIME GREEN BOUDICCA RING
22692,DOORMAT WELCOME TO OUR HOME
84596J,MIXED NUTS LIGHT GREEN BOWL
22535,MAGIC DRAWING SLATE BUNNIES 
21373,MIRRORED WALL ART SNOWFLAKES
22666,RECIPE BOX PANTRY YELLOW DESIGN
23118,PARISIENNE JEWELLERY DRAWER 
22989,SET 2 PANTRY DESIGN TEA TOWELS
90001B,ANTIQUE MID BLUE FLOWER EARRINGS
84192,ASSORTED COLOUR METAL CAT 
22627,MINT KITCHEN SCALES
22616,PACK OF 12 LONDON TISSUES 
35817P,"ACRYLIC JEWEL SNOWFLAKE,PINK"
20755,BLUE PAISLEY POCKET BOOK
84675,FROG KING WATERING CAN
47021G,SET/6 BEAD COASTERS GAUZE BAG GOLD
84708B,PINK JEWELLED PHOTO FRAME 
23004,TRAVEL CARD WALLET PANTRY
22962,JAM JAR WITH PINK LID
23128,DOLLCRAFT BOY JEAN-PAUL 
90083,CRYSTAL CZECH CROSS PHONE CHARM
22641,SET OF 4 NAPKIN CHARMS INSTRUMENT
22762,CUPBOARD 3 DRAWER MA CAMPAGNE
90165B,WHITE ROSEBUD  PEARL EARRINGS
84800M,MEDIUM WHITE/PINK ROSE ART FLOWER
22690,DOORMAT HOME SWEET HOME BLUE 
23459,DOLLY CABINET 2 DRAWERS 
22460,EMBOSSED GLASS TEALIGHT HOLDER
20963,APPLE BATH SPONGE
20717,STRAWBERRY SHOPPER BAG
21579,LOLITA  DESIGN  COTTON TOTE BAG
82001S,SILVER RECORD COVER FRAME
22511,RETROSPOT BABUSHKA DOORSTOP
21889,WOODEN BOX OF DOMINOES
22193,RED DINER WALL CLOCK
22442,GROW YOUR OWN FLOWERS SET OF 3
23335,EGG FRYING PAN IVORY 
21270,ANTIQUE CREAM CUTLERY CUPBOARD
85136B,BLUE SHARK HELICOPTER
85054,FRENCH ENAMEL POT W LID
47344B,BLUE FLOWER DES PURSE
23022,SMALL BONNE JAM JAR  T-LIGHT HOLDER
20696,FLORAL SOFT CAR TOY
21446,12 RED ROSE PEG PLACE SETTINGS
23435,3 RAFFIA RIBBONS VINTAGE CHRISTMAS
22431,WATERING CAN BLUE ELEPHANT
35816P,"ACRYLIC JEWEL ANGEL,PINK"
18097A,PINK TALL PORCELAIN T-LIGHT HOLDER 
22957,SET 3 PAPER VINTAGE CHICK PAPER EGG
51020A,SUMMER FUN DESIGN SHOWER CAP
23424,GINGHAM RECIPE BOOK BOX
84817,DANISH ROSE DECORATIVE PLATE
21537,RED RETROSPOT PUDDING BOWL
85130C,BEADED CRYSTAL HEART BLUE  LARGE
22580,ADVENT CALENDAR GINGHAM SACK
21318,GLASS CHALICE BLUE SMALL 
23395,BELLE JARDINIERE CUSHION COVER
85049H,URBAN BLACK RIBBONS 
21905,MORE BUTTER METAL SIGN 
23389,SPACEBOY MINI BACKPACK
21827,EIGHT PIECE CREEPY CRAWLIE SET
22867,HAND WARMER BIRD DESIGN
84465,15 PINK FLUFFY CHICKS IN BOX
22045,SPACEBOY GIFT WRAP
22917,HERB MARKER ROSEMARY
21973,SET OF 36 MUSHROOM PAPER DOILIES
90214U,"LETTER 'U'"" BLING KEY RING"""
72802A,ROSE SCENT CANDLE IN JEWELLED BOX
21647,ASSORTED TUTTI FRUTTI LARGE PURSE
23337,EGG FRYING PAN MINT 
21211,SET OF 72 SKULL PAPER  DOILIES
84875D,BLUE SQUARE COMPACT MIRROR
90018C,SILVER BLACK ORBIT DROP EARRINGS
22796,PHOTO FRAME 3 CLASSIC HANGING
23571,TRADITIONAL NAUGHTS & CROSSES
90184B,AMETHYST CHUNKY BEAD BRACELET W STR
10123C,HEARTS WRAPPING TAPE 
21430,SET/3 RED GINGHAM ROSE STORAGE BOX
23462,ROCOCO WALL MIROR
21873,IF YOU CAN'T STAND THE HEAT MUG
23630,SET 10 CARDS HANGING BAUBLES 17080
21789,KIDS RAIN MAC PINK
22085,PAPER CHAIN KIT SKULLS 
84660B,BLACK STITCHED WALL CLOCK
85187,S/12 MINI RABBIT EASTER
21618,4 WILDFLOWER BOTANICAL CANDLES
23122,PARTY CHARMS 50 PIECES
22741,FUNKY DIVA PEN
72803A,ROSE SCENT CANDLE JEWELLED DRAWER
22898,CHILDRENS APRON APPLES DESIGN
21455,PAINTED YELLOW WOODEN DAISY
21386,IVORY HANGING DECORATION  EGG
22523,CHILDS GARDEN FORK PINK
17084A,TRANQUILITY MASALA INCENSE
21207,SKULL AND CROSSBONES  GARLAND 
22983,CARD BILLBOARD FONT
22873,NUMBER TILE COTTAGE GARDEN 5
20867,PINK ROSE FABRIC MIRROR
22090,PAPER BUNTING RETROSPOT
17012F,ORIGAMI SANDLEWOOD INCENSE/CAND SET
22127,PARTY CONES CARNIVAL ASSORTED
23554,LANDMARK FRAME OXFORD STREET
20769,DAISY JOURNAL 
90000D,COPPER/OLIVE GREEN FLOWER NECKLACE
21457,2 PICTURE BOOK EGGS EASTER DUCKS
23320,GIANT 50'S CHRISTMAS CRACKER
23066,SMALL DECO JEWELLERY STAND
22990,COTTON APRON PANTRY DESIGN
35921,EASTER BUNNY HANGING GARLAND
81950B,FLOWER BLUE CLOCK WITH SUCKER
22037,ROBOT BIRTHDAY CARD
22339,CHRISTMAS TREE PAINTED ZINC 
90200C,BLUE SWEETHEART BRACELET
22821,GIFT BAG PSYCHEDELIC APPLES
37340,MULTICOLOUR SPRING FLOWER MUG
23103,BELL HEART DECORATION
23183,MOTHER'S KITCHEN SPOON REST 
90030C,BROWN KUKUI COCONUT SEED NECKLACE
23360,SET 8 CANDLES VINTAGE DOILEY
23388,WOODLAND MINI BACKPACK
22211,WOOD STAMP SET FLOWERS
22732,3D VINTAGE CHRISTMAS STICKERS 
22659,LUNCH BOX I LOVE LONDON
22224,WHITE LOVEBIRD LANTERN
20840,FRENCH FLORAL CUSHION COVER 
21175,GIN + TONIC DIET METAL SIGN
20827,GOLD APERITIF GLASS
22650,CERAMIC PIRATE CHEST MONEY BANK
21937,STRAWBERRY   PICNIC BAG
21638,ASSORTED TUTTI FRUTTI NOTEBOOK
22323,PINK POLKADOT KIDS BAG
71459,HANGING JAM JAR T-LIGHT HOLDER
20663,QUEEN OF THE SKIES HOLIDAY PURSE 
21528,DAIRY MAID TRADITIONAL TEAPOT 
85199L,LARGE HANGING IVORY & RED WOOD BIRD
20847,ZINC HEART LATTICE CHARGER LARGE
22792,FLUTED ANTIQUE CANDLE HOLDER
23536,VILLAGE SHOW WALL ART
22242,5 HOOK HANGER MAGIC TOADSTOOL
21352,EUCALYPTUS & PINECONE  WREATH
35649,VINTAGE BEAD COSMETIC BAG 
22975,SPACEBOY CHILDRENS EGG CUP
21034,REX CASH+CARRY JUMBO SHOPPER
21948,SET OF 6 CAKE CHOPSTICKS
23481,PEARLISED IVORY HEART SMALL 
21615,4 LAVENDER BOTANICAL DINNER CANDLES
84006,MAGIC TREE -PAPER FLOWERS
90033,IVORY SHELL HEART EARRINGS
20857,BLUE ROSE PATCH PURSE PINK BUTTERFL
21892,TRADITIONAL WOODEN CATCH CUP GAME 
22092,BLUE PAISLEY TISSUE BOX
22248,DECORATION  PINK CHICK MAGIC GARDEN
35971,ROSE FOLKART HEART DECORATIONS
22714,CARD BIRTHDAY COWBOY
23314,VINTAGE CHRISTMAS TABLECLOTH
22245,"HOOK, 1 HANGER ,MAGIC GARDEN"
22175,PINK OWL SOFT TOY
22025,RING OF ROSES BIRTHDAY CARD
90102,WHITE FRANGIPANI HAIR CLIP
84877B,GREEN ROUND COMPACT MIRROR
16169P,WRAP GREEN RUSSIAN FOLKART 
23171,REGENCY TEA PLATE GREEN 
22250,DECORATION  BUTTERFLY  MAGIC GARDEN
22525,CHILDRENS GARDEN GLOVES PINK
82580,BATHROOM METAL SIGN
21622,VINTAGE UNION JACK CUSHION COVER
35910A,MULTICOLOUR EASTER RABBIT 
23036,T-LIGHT HOLDER SILVER PETIT FOUR 
47518F,ICON PLACEMAT POP ART ELVIS
35911A,MULTICOLOUR RABBIT EGG WARMER
23203,JUMBO BAG DOILEY PATTERNS
20761,BLUE PAISLEY SKETCHBOOK
22635,CHILDS BREAKFAST SET DOLLY GIRL 
21495,SKULLS AND CROSSBONES WRAP
20848,ZINC HEART LATTICE CHARGER SMALL
37509,NEW ENGLAND MUG W GIFT BOX
22703,PINK CAT BOWL
90206C,CRYSTAL DIAMANTE STAR BROOCH
21069,VINTAGE BILLBOARD TEA MUG
90073,VINTAGE ENAMEL & CRYSTAL EARRINGS
79144C,PAINTED LIGHTBULB RAINBOW DESIGN
22518,CHILDS GARDEN BRUSH BLUE
23271,CHRISTMAS TABLE CANDLE SILVER SPIKE
23393,HOME SWEET HOME CUSHION COVER 
22273,FELTCRAFT DOLL MOLLY
84873A,FUNKY FLOWER PICNIC BAG FOR 4
16237,SLEEPING CAT ERASERS
22543,MINI JIGSAW BAKE A CAKE 
21260,FIRST AID TIN
23166,MEDIUM CERAMIC TOP STORAGE JAR
22115,METAL SIGN EMPIRE TEA
22977,DOLLY GIRL CHILDRENS EGG CUP
84804A,CREAM DELPHINIUM ARTIFICIAL FLOWER
21154,RED RETROSPOT OVEN GLOVE 
22260,FELT EGG COSY BLUE RABBIT 
22427,ENAMEL FLOWER JUG CREAM
21088,SET/6 FRUIT SALAD PAPER CUPS
23477,WOODLAND LARGE BLUE FELT HEART
22845,VINTAGE CREAM CAT FOOD CONTAINER
22510,GINGHAM BABUSHKA DOORSTOP
22184,CAKE STAND VICTORIAN FILIGREE LARGE
85199S,SMALL HANGING IVORY/RED WOOD BIRD
51008,AFGHAN SLIPPER SOCK PAIR
22861,EASTER TIN CHICKS IN GARDEN
85136A,YELLOW SHARK HELICOPTER
90138,WHITE/PINK MINI CRYSTALS NECKLACE
22878,NUMBER TILE COTTAGE GARDEN No
21698,MOCK LOBSTER FRIDGE MAGNET
23147,SINGLE ANTIQUE ROSE HOOK IVORY
23094,LE GRAND TRAY CHIC SET
84509G,SET OF 4 FAIRY CAKE PLACEMATS 
22053,EMPIRE DESIGN ROSETTE
90159,COTE D'AZURE NECKLACE
22130,PARTY CONE CHRISTMAS DECORATION 
22494,EMERGENCY FIRST AID TIN 
84741C,CITRUS GARLAND FELT FLOWERS 
22162,HEART GARLAND RUSTIC PADDED
21983,PACK OF 12 BLUE PAISLEY TISSUES 
22884,NUMBER TILE VINTAGE FONT 5
20770,ABSTRACT CIRCLE JOURNAL 
35271S,GOLD PRINT PAPER BAG
22212,FOUR HOOK  WHITE LOVEBIRDS
22907,PACK OF 20 NAPKINS PANTRY DESIGN
82615,PINK MARSHMALLOW SCARF KNITTING KIT
21642,ASSORTED TUTTI FRUTTI PEN
22827,RUSTIC  SEVENTEEN DRAWER SIDEBOARD
21509,COWBOYS AND INDIANS BIRTHDAY CARD 
21918,SET 12 KIDS COLOUR  CHALK STICKS
85130A,BEADED PEARL HEART WHITE LARGE
21750,LARGE SKULL WINDMILL
20894,HANGING BAUBLE T-LIGHT HOLDER LARGE
23597,PAPER BUNTING PAISLEY PARK
51014A,"FEATHER PEN,HOT PINK"
22399,MAGNETS PACK OF 4 CHILDHOOD MEMORY
72134,COLUMBIAN  CUBE CANDLE 
78034B,BLUE NETTING STORAGE HANGER
85036C,ROSE 1 WICK MORRIS BOXED CANDLE
72801G,4 BURGUNDY WINE DINNER CANDLES
20823,GOLD WINE GOBLET
22967,SET 3 SONG BIRD PAPER EGGS ASSORTED
23156,SET OF 5 MINI GROCERY MAGNETS
23305,SET 4 PICNIC CUTLERY BLUEBERRY
23284,DOORMAT KEEP CALM AND COME IN
22705,WRAP GREEN PEARS 
84247N,PACK/12 BLUE FOLKART CARDS
18007,ESSENTIAL BALM 3.5g TIN IN ENVELOPE
90026C,GLASS BEAD HOOP NECKLACE GREEN
22625,RED KITCHEN SCALES
90071,RUBY GLASS CLUSTER EARRINGS
21039,RED RETROSPOT SHOPPING BAG
20754,RETROSPOT RED WASHING UP GLOVES
22444,GROW YOUR OWN PLANT IN A CAN 
16207A,PINK STRAWBERRY HANDBAG 
21030,SPACE CADET RED
90059E,DIAMANTE HAIR GRIP PACK/2 RUBY
23512,EMBROIDERED RIBBON REEL ROSIE
23301,GARDENERS KNEELING PAD KEEP CALM 
22966,GINGERBREAD MAN COOKIE CUTTER
85078,SCANDINAVIAN 3 HEARTS NAPKIN RING
90154,LAZER CUT NECKLACE W PASTEL BEADS
23173,REGENCY TEAPOT ROSES 
23407,SET OF 2 TRAYS HOME SWEET HOME
47341A,FUSCHIA TABLE RUN FLOWER 
90160B,RED BOUDICCA LARGE BRACELET
81950V,FLOWER PURPLE CLOCK W/SUCKER
21875,KINGS CHOICE MUG
37491C,GREEN/BLUE CERAMIC CANDLE HOLDER
22914,BLUE COAT RACK PARIS FASHION
90010B,BLACK/WHITE GLASS/SILVER BRACELET
21116,OWL DOORSTOP
22144,CHRISTMAS CRAFT LITTLE FRIENDS
22952,60 CAKE CASES VINTAGE CHRISTMAS
