stock_code,description
21845,DAIRY MAID STRIPE MUG
21306,SET/4 DAISY MIRROR MAGNETS
85008,SET OF 3 CONEY ISLAND OVAL BOXES
23530,WALL ART ONLY ONE PERSON 
20725,LUNCH BAG RED RETROSPOT
23308,SET OF 60 VINTAGE LEAF CAKE CASES 
22031,BOTANICAL LAVENDER BIRTHDAY CARD
22503,CABIN BAG VINTAGE PAISLEY
84800L,LARGE WHITE/PINK ROSE ART FLOWER
22887,NUMBER TILE VINTAGE FONT 8
22626,BLACK KITCHEN SCALES
21815,STAR  T-LIGHT HOLDER 
21891,TRADITIONAL WOODEN SKIPPING ROPE
20851,ZINC HEART LATTICE TRAY OVAL 
21975,PACK OF 60 DINOSAUR CAKE CASES
21613,S/12 VANILLA  BOTANICAL T-LIGHTS
21147,JINGLE BELLS TREE DECORATION
22438,BALLOON ART MAKE YOUR OWN FLOWERS
22926,IVORY GIANT GARDEN THERMOMETER
21165,BEWARE OF THE CAT METAL SIGN 
47503A,ASS FLORAL PRINT MULTI SCREWDRIVER
84968D,SET OF 16 VINTAGE RED CUTLERY
21040,MODERN VINTAGE COTTON SHOPPING BAG
62094B,TURQ ICE CREAM BUM BAG 
85066,CREAM SWEETHEART MINI CHEST
21314,SMALL GLASS HEART TRINKET POT
85109,PINK BOUDOIR T-LIGHT HOLDER
23014,GLASS APOTHECARY BOTTLE ELIXIR
85132A,CHARLIE + LOLA BISCUITS TINS
21367,MIRRORED WALL ART GENTS
84745B,BLUE HANGING GINGHAM EASTER HEN
21974,SET OF 36 PAISLEY FLOWER DOILIES
90210C,RED   ACRYLIC FACETED BANGLE
21847,GREEN  DIAMANTE PEN IN GIFT BOX
22591,CARDHOLDER GINGHAM CHRISTMAS TREE
84033,FLAG OF ST GEORGE 
22076,6 RIBBONS EMPIRE  
21754,HOME BUILDING BLOCK WORD
21414,SCALLOP SHELL SOAP DISH
22886,NUMBER TILE VINTAGE FONT 7
23247,BISCUIT TIN 50'S CHRISTMAS
20748,KENSINGTON COFFEE SET
10080,GROOVY CACTUS INFLATABLE
21911,GARDEN METAL SIGN 
22885,NUMBER TILE VINTAGE FONT 6 
84951B,SET OF 4 BLACK LOVEBIRD COASTERS
22488,NATURAL SLATE RECTANGLE CHALKBOARD
22365,DOORMAT RESPECTABLE HOUSE
90136,PALE PINK/AMETHYST STONE NECKLACE
22061,LARGE CAKE STAND  HANGING STRAWBERY
23008,DOLLY GIRL BABY GIFT SET
22445,PENCIL CASE LIFE IS BEAUTIFUL
22384,LUNCH BAG PINK POLKADOT
21562,HAWAIIAN GRASS SKIRT 
20670,VIP HOLIDAY PURSE
84509B,SET OF 4 FAIRY CAKE PLACEMATS
20727,LUNCH BAG  BLACK SKULL.
84949,SILVER HANGING T-LIGHT HOLDER
23542,70'S ALPHABET WALL ART
90089,PINK CRYSTAL SKULL PHONE CHARM
23113,PANTRY CHOPPING BOARD
35647,VINTAGE BEAD PINK SHADE 
21581,SKULLS  DESIGN  COTTON TOTE BAG
22866,HAND WARMER SCOTTY DOG DESIGN
22593,CHRISTMAS GINGHAM STAR
22265,EASTER DECORATION NATURAL CHICK
84226,HEN HOUSE W FAMILY IN BARN & NEST
17096,ASSORTED LAQUERED INCENSE HOLDERS
22077,6 RIBBONS RUSTIC CHARM
22364,GLASS JAR DIGESTIVE BISCUITS
20659,ECONOMY LUGGAGE TAG
20767,BLUE PAISLEY JOURNAL 
23185,FRENCH STYLE STORAGE JAR JAM
22498,WOODEN REGATTA BUNTING
22628,PICNIC BOXES SET OF 3 RETROSPOT 
21356,TOAST ITS - FAIRY FLOWER
47591D,PINK FAIRY CAKE CHILDRENS APRON
23566,EGG CUP MILKMAID HEIDI
23089,GLASS BON BON JAR
85179A,GREEN BITTY LIGHT CHAIN
21684,SMALL MEDINA STAMPED METAL BOWL 
84945,MULTI COLOUR SILVER T-LIGHT HOLDER
84952C,MIRROR LOVE BIRD T-LIGHT HOLDER
23188,VINTAGE  2 METER FOLDING RULER
22267,EASTER DECORATION EGG BUNNY 
37468,HARDMAN MUG 3 ASSORTED
22668,PINK BABY BUNTING
22415,WHITE TISSUE REAM
21402,RED  EGG  SPOON
90000B,MIDNIGHT BLUE COPPER FLOWER NECKLAC
90142D,MOP PENDANT SHELL NECKLACE
17021,NAMASTE SWAGAT INCENSE
72131,COLUMBIAN CANDLE RECTANGLE
20774,GREEN FERN NOTEBOOK
22341,LOVE GARLAND PAINTED ZINC 
90012B,BLACK DROP CRYSTAL NECKLACE
21399,BLUE POLKADOT COFFEE MUG
22301,COFFEE MUG CAT + BIRD DESIGN
23293,SET OF 12 FAIRY CAKE BAKING CASES
23581,JUMBO BAG PAISLEY PARK
84429A,MEDIUM PINK BUDDHA HEAD 
22782,SET 3 WICKER STORAGE BASKETS 
22180,RETROSPOT LAMP
22255,FELT TOADSTOOL  SMALL
20719,WOODLAND CHARLOTTE BAG
21243,PINK  POLKADOT PLATE 
85170A,SET/6 IVORY BIRD T-LIGHT CANDLES
23694,PAISLEY PARK CARD
85161,ACRYLIC GEOMETRIC LAMP
22671,FRENCH LAUNDRY SIGN BLUE METAL
84012,MAGIC SHEEP WOOL GROWING FROM PAPER
22834,HAND WARMER BABUSHKA DESIGN
84763,ZINC FINISH 15CM PLANTER POTS
22631,CIRCUS PARADE LUNCH BOX 
84750A,PINK SMALL GLASS CAKE STAND
20704,MR ROBOT SOFT TOY
23132,SMALL IVORY HEART WALL ORGANISER
23287,RED VINTAGE SPOT BEAKER
23427,STOOL HOME SWEET HOME 
90161B,ANT COPPER TURQ BOUDICCA BRACELET
23398,HANGING HEART BONHEUR
17012C,ORIGAMI LAVENDER INCENSE/CANDL SET 
23466,TUSCAN VILLA DOVECOTE
62086A,PINK RETRO BIG FLOWER BAG
72799F,IVORY PILLAR CANDLE GOLD FLOCK
16156L,WRAP CAROUSEL
23127,DOLLCRAFT GIRL NICOLE
23458,DOLLY CABINET 3 DRAWERS 
21694,SMALL REGAL  SILVER CANDLEPOT 
22080,RIBBON REEL POLKADOTS 
23544,WALL ART MID CENTURY MODERN 
84884A,ANT WHITE WIRE HEART SPIRAL
84795B,SUNSET CHECK HAMMOCK
21055,TOOL BOX SOFT TOY 
84402B,PURPLE DRESS JEWELLERY STAND
90125D,PURPLE BERTIE GLASS BEAD BAG CHARM
22847,BREAD BIN DINER STYLE IVORY
84795C,OCEAN STRIPE HAMMOCK 
23194,GYMKHANA TREASURE BOOK BOX
84459B,YELLOW METAL CHICKEN HEART 
85114C,RED ENCHANTED FOREST PLACEMAT
22410,MONEY BOX HOUSEKEEPING DESIGN
22541,MINI JIGSAW LEAP FROG
22502,PICNIC BASKET WICKER 60 PIECES
22905,CALENDAR IN SEASON DESIGN
22661,CHARLOTTE BAG DOLLY GIRL DESIGN
84796A,PINK HAWAIIAN PICNIC HAMPER FOR 2
84497,BUTTONS AND STRIPES NOTEBOOK 
35920,FOUR RABBIT EASTER DECORATIONS
84842,HELLO SAILOR BATHROOM SET
21383,PACK OF 12 STICKY BUNNIES
16020C,CLEAR STATIONERY BOX SET 
22202,MILK PAN PINK POLKADOT
47593B,SCOTTIE DOGS BABY BIB
17090D,VANILLA INCENSE 40 CONES IN TIN
21115,ROSE CARAVAN DOORSTOP
21916,SET 12 RETRO WHITE CHALK STICKS
22715,CARD WEDDING DAY
23269,SET OF 2 CERAMIC CHRISTMAS TREES
22363,GLASS JAR MARMALADE 
37479B,CUBIC MUG FLOCK BLUE ON BROWN
23415,HOME SWEET HOME HOOK
84592,CROCHET ROSE PURSE WITH SUEDE BACK
79063C,"RETRO PILL BOX KEY CHAIN,THE KING"
23348,CHILDRENS TOY COOKING UTENSIL SET
90003D,CRYSTAL PAIR HEART HAIR SLIDES
21904,HOUSE WRECKING METAL SIGN 
22443,GROW YOUR OWN HERBS SET OF 3
47585A,PINK FAIRY CAKE CUSHION COVER
23574,PACKING CHARGE
22499,WOODEN UNION JACK BUNTING
35001G,HAND OPEN SHAPE GOLD
22086,PAPER CHAIN KIT 50'S CHRISTMAS 
90124B,BLUE MURANO TWIST NECKLACE
22943,CHRISTMAS LIGHTS 10 VINTAGE BAUBLES
23150,IVORY SWEETHEART SOAP DISH
84032A,CHARLIE+LOLA PINK HOT WATER BOTTLE
21777,RECIPE BOX WITH METAL HEART
21719,LOVELY BONBON STICKER SHEET
22766,PHOTO FRAME CORNICE
21084,SET/6 COLLAGE PAPER CUPS
85141,JARDIN ETCHED GLASS FRUITBOWL
20869,GOLD FABRIC MIRROR
21657,MILK BOTTLE WITH GLASS STOPPER 
90081A,LILY BROOCH AMETHYST COLOUR
23069,EDWARDIAN PHOTO FRAME
71038,WHITE HANGING BEADS CANDLE HOLDER
46118,FUNKY MONKEY CUSHION COVER
22711,WRAP CIRCUS PARADE
22178,VICTORIAN GLASS HANGING T-LIGHT
72800B, 4 PURPLE FLOCK DINNER CANDLES
47503H,ASS FLORAL PRINT SPIRIT LEVEL 
22338,STAR DECORATION PAINTED ZINC 
22311,OFFICE MUG WARMER BLACK+SILVER 
90018B,GOLD M.O.P ORBIT DROP EARRINGS
21931,JUMBO STORAGE BAG SUKI
84926D,LA PALMIERA TILE COASTER
90081C,LILY BROOCH OLIVE COLOUR
23505,PLAYING CARDS I LOVE LONDON 
21733,RED HANGING HEART T-LIGHT HOLDER
23444,Next Day Carriage
90059B,DIAMANTE HAIR GRIP PACK/2 BLACK DIA
22125,UNION JACK HOT WATER BOTTLE 
23142,IVORY WIRE KITCHEN ORGANISER
85099F,JUMBO BAG STRAWBERRY
21946,PARTY TIME DESIGN FLANNEL
20716,PARTY FOOD SHOPPER BAG
20798,CLEAR MILKSHAKE GLASS
22685,FRENCH BLUE METAL DOOR SIGN 0
84375,SET OF 20 KIDS COOKIE CUTTERS
85047,WHITE BEADED GARLAND STRING 20LIGHT
22279,POCKET BAG BLUE PAISLEY RED SPOT
22634,CHILDS BREAKFAST SET SPACEBOY 
84569C,PACK 4 FLOWER/BUTTERFLY PATCHES
47351B,BLUE  VOILE LAMPSHADE
23299,"FOOD COVER WITH BEADS , SET 2 SIZES"
22667,RECIPE BOX RETROSPOT 
21972,SET OF 36 DINOSAUR PAPER DOILIES
90129B,TURQUOISE GLASS TASSLE BAG CHARM 
22507,MEMO BOARD RETROSPOT  DESIGN
22587,FELTCRAFT HAIRBAND RED AND BLUE
21094,SET/6 RED SPOTTY PAPER PLATES
22747,POPPY'S PLAYHOUSE BATHROOM
82011A,"BATHROOM SCALES, TROPICAL BEACH"
23120,PACK OF 6 SMALL FRUIT STRAWS
20652,BLUE POLKADOT LUGGAGE TAG 
23539,"WALL ART , LOVES'' SECRET "
21080,SET/20 RED RETROSPOT PAPER NAPKINS 
21949,SET OF 6 STRAWBERRY CHOPSTICKS
72802B,OCEAN SCENT CANDLE IN JEWELLED BOX
84660A,WHITE STITCHED WALL CLOCK
44091A,BLUE CRUSOE CHECK LAMPSHADE
85059,FRENCH ENAMEL WATER BASIN
85225,BLING KEY RING STAND
22214,CANDLE PLATE LACE WHITE
21452,TOADSTOOL MONEY BOX
22997,TRAVEL CARD WALLET UNION JACK
21770,OPEN CLOSED METAL SIGN
22477,WATERING CAN GARDEN MARKER
37447,CERAMIC CAKE DESIGN SPOTTED PLATE
85031C,CURIOUS IMAGES SCRAP BOOK SET
22411,JUMBO SHOPPER VINTAGE RED PAISLEY
85071C,"CHARLIE+LOLA'EXTREMELY BUSY'"" SIGN"""
20897,VINTAGE NOTEBOOK PARIS DAYS
22432,WATERING CAN PINK BUNNY
47504H,ENGLISH ROSE SPIRIT LEVEL 
22374,AIRLINE BAG VINTAGE JET SET RED
22352,LUNCH BOX WITH CUTLERY RETROSPOT 
23252,ENAMEL JUG PANTRY
45013,FOLDING SHOE TIDY
90152C,BLUE/NAT SHELL NECKLACE W PENDANT
48116,DOORMAT MULTICOLOUR STRIPE
84228,HEN HOUSE W CHICK STANDING
22558,CLOTHES PEGS RETROSPOT PACK 24 
90152A,SILVER/NAT SHELL NECKLACE W PENDANT
21804,WHITE CHRISTMAS GARLAND STARS TREES
22820,GIFT BAG BIRTHDAY
84826,ASSTD DESIGN 3D PAPER STICKERS
22750,FELTCRAFT PRINCESS LOLA DOLL
22332,SKULLS PARTY BAG + STICKER SET
72351A,SET/6 TURQUOISE BUTTERFLY T-LIGHTS
85053,FRENCH ENAMEL CANDLEHOLDER
21179,NO JUNK MAIL METAL SIGN
35970,ZINC FOLKART SLEIGH BELLS
22217,T-LIGHT HOLDER HANGING LACE
22526,WHEELBARROW FOR CHILDREN 
90190A,SILVER/CRYSTAL DROP EARRINGS W LEAF
23681,LUNCH BAG RED VINTAGE DOILY
21470,FLOWER VINE RAFFIA FOOD COVER
22285,"DECORATION HEN ON NEST, HANGING"
17174,ASSTD RASTA KEY-CHAINS
21078,SET/20 STRAWBERRY PAPER NAPKINS 
20868,SILVER FABRIC MIRROR
23302,KNEELING MAT HOUSEWORK  DESIGN
90196A,PURPLE GEMSTONE NECKLACE 45CM
21087,SET/6 POSIES PAPER CUPS
22585,PACK OF 6 BIRDY GIFT TAGS
22284,HEN HOUSE DECORATION
84731,3 BIRDS CANVAS SCREEN
21108,FAIRY CAKE FLANNEL ASSORTED COLOUR
90198A,VINTAGE ROSE BEAD BRACELET RASPBERR
84921,CREAM AND PINK FLOWERS PONY 
21357,TOAST ITS - DINOSAUR
21061,PARTY INVITES FOOTBALL
22034,ROBIN CHRISTMAS CARD
90200E,GREEN SWEETHEART BRACELET
84987,SET OF 36 TEATIME PAPER DOILIES
90160D,PINK BOUDICCA LARGE BRACELET
71496B,A4 WALL TIDY RED FLOWERS
21473,SWEETHEART CREAM STEEL TABLE RECT
23409,PHOTO FRAME LINEN AND LACE LARGE
84231,EASTER BUNNY WITH BASKET ON BACK
90190C,SILVER/AMETHYST DROP EARRINGS LEAF
90120C,GREEN MURANO TWIST BRACELET
16168M,FUNKY MONKEY GIFT BAG MEDIUM
21413,PERIWINKLE T-LIGHT HOLDER
21456,2 PICTURE BOOK EGGS EASTER CHICKS
22376,AIRLINE BAG VINTAGE JET SET WHITE
21111,"SWISS ROLL TOWEL, CHOCOLATE  SPOTS"
84802A,WHITE ANEMONE ARTIFICIAL FLOWER
23129,HEART SHAPED HOLLY WREATH
21370,MIRRORED WALL ART FOXY
22822,CREAM WALL PLANTER HEART SHAPED
90059F,DIAMANTE HAIR GRIP PACK/2 LT ROSE
85055,FRENCH ENAMEL UTENSIL HOLDER
23023,RIDGED BONNE JAM JAR T-LIGHT HOLDER
21001,ROSE DU SUD WASHBAG 
23843,"PAPER CRAFT , LITTLE BIRDIE"
22110,BIRD HOUSE HOT WATER BOTTLE
23163,REGENCY SUGAR TONGS
90039A,FIRE POLISHED GLASS BRACELET RED
21629,SQUARE FLOOR CUSHION VINTAGE RED
84352,SILVER CHRISTMAS TREE BAUBLE STAND 
84596F,SMALL MARSHMALLOWS PINK BOWL
90038C,GLASS AND BEADS BRACELET IVORY
23408,PHOTO FRAME LINEN AND LACE SMALL
22743,MAKE YOUR OWN FLOWERPOWER CARD KIT
21408,SPOTTY PINK DUCK DOORSTOP
21826,EIGHT PIECE DINOSAUR SET
22579,WOODEN TREE CHRISTMAS SCANDINAVIAN
23224,CHERUB HEART DECORATION GOLD
22699,ROSES REGENCY TEACUP AND SAUCER 
16161M,WRAP  PINK FLOCK
22710,WRAP I LOVE LONDON 
90135,ORANGE/WHT/FUSCHIA STONES NECKLACE
22071,SMALL WHITE RETROSPOT MUG IN BOX 
22806,SET OF 6 T-LIGHTS WEDDING CAKE 
85150,LADIES & GENTLEMEN METAL SIGN
23333,IVORY WICKER HEART MEDIUM
23187,FRENCH STYLE STORAGE JAR BONBONS
21390,FILIGRIS HEART WITH BUTTERFLY
22869,NUMBER TILE COTTAGE GARDEN 1
22233,JIGSAW RABBIT AND BIRDHOUSE
82583,HOT BATHS METAL SIGN
22504,CABIN BAG VINTAGE RETROSPOT
22429,ENAMEL MEASURING JUG CREAM
17084P,DRAGONS BLOOD INCENSE
23697,A PRETTY THANK YOU CARD
22246,"GARLAND, MAGIC GARDEN 1.8M"
85099B,JUMBO BAG RED RETROSPOT
22309,TEA COSY RED  STRIPE
21379,CAMPHOR WOOD PORTOBELLO MUSHROOM
84422,PINK/BLUE DISC/MIRROR STRING
22168,ORGANISER WOOD ANTIQUE WHITE 
85071A,BLUE CHARLIE+LOLA PERSONAL DOORSIGN
22418,10 COLOUR SPACEBOY PEN
21675,BUTTERFLIES STICKERS
90202B,WHITE ENAMEL FLOWER HAIR TIE
22434,BALLOON PUMP WITH 10 BALLOONS
21625,VINTAGE UNION JACK APRON
90175C,BLUE GLASS CHUNKY CHARM BRACELET
90103,PURPLE FRANGIPANI NECKLACE
21181,PLEASE ONE PERSON METAL SIGN
16236,KITTY PENCIL ERASERS
23328,SET 6 SCHOOL MILK BOTTLES IN CRATE
90189A,SILVER 2 STRAND NECKLACE-LEAF CHARM
85163A,WHITE BAROQUE WALL CLOCK 
22153,ANGEL DECORATION STARS ON DRESS
47559B,TEA TIME OVEN GLOVE
21202,DOLLY HONEYCOMB GARLAND
21775,DECORATIVE FLORE BATHROOM BOTTLE
90124C,GREEN MURANO TWIST NECKLACE
23446,BLUE BUNNY EASTER EGG BASKET
22933,BAKING MOULD EASTER EGG MILK CHOC
22843,BISCUIT TIN VINTAGE GREEN
84706D,CHERRY BLOSSOM TABLE CLOCK 
21830,ASSORTED CREEPY CRAWLIES
90019C,SILVER BLACK ORBIT BRACELET
22218,CAKE STAND LACE WHITE
85039A,SET/4 RED MINI ROSE CANDLE IN BOWL
22529,MAGIC DRAWING SLATE GO TO THE FAIR 
21503,TOYBOX  WRAP 
23410,CURIO CABINET LINEN AND LACE 
21063,PARTY INVITES JAZZ HEARTS
21902,"KEY FOB , FRONT  DOOR "
23288,GREEN VINTAGE SPOT BEAKER
22516,CHILDS GARDEN RAKE BLUE
23473,WOODLAND SMALL RED FELT HEART
22924,FRIDGE MAGNETS LA VIE EN ROSE
84510E,SET OF 4 GREEN CAROUSEL COASTERS
23192,BUNDLE OF 3 ALPHABET EXERCISE BOOKS
21933,PINK VINTAGE PAISLEY PICNIC BAG
22669,RED BABY BUNTING 
21249,WOODLAND  HEIGHT CHART STICKERS 
22141,CHRISTMAS CRAFT TREE TOP ANGEL
23193,BUFFALO BILL TREASURE BOOK BOX
79190A,RETRO PLASTIC 70'S TRAY
84799,SPRIG LAVENDER ARTIFICIAL FLOWER
23331,DECORATIVE WICKER HEART SMALL
84854,GIRLY PINK TOOL SET
23082,SET 6 PAPER TABLE LANTERN HEARTS 
22104,MIRROR MOSAIC CANDLE PLATE
21592,RETROSPOT CIGAR BOX MATCHES 
21587,COSY HOUR GIANT TUBE MATCHES
21812,GARLAND WITH HEARTS AND BELLS
90082D,DIAMANTE BOW BROOCH BLACK COLOUR
22939,ADULT APRON APPLE DELIGHT
72349B,SET/6 PURPLE BUTTERFLY T-LIGHTS
22814,CARD PARTY GAMES 
85039B,S/4 IVORY MINI ROSE CANDLE IN BOWL
20723,STRAWBERRY CHARLOTTE BAG
22720,SET OF 3 CAKE TINS PANTRY DESIGN 
72807B,SET/3 OCEAN SCENT CANDLE JEWEL BOX
85017B,ENVELOPE 50 BLOSSOM IMAGES
22918,HERB MARKER PARSLEY
85049D,BRIGHT BLUES RIBBONS 
22589,CARDHOLDER GINGHAM STAR
21355,TOAST ITS - I LOVE YOU 
22877,NUMBER TILE COTTAGE GARDEN 9
23158,SET OF 5 LUCKY CAT MAGNETS 
22189,CREAM HEART CARD HOLDER
22156,HEART DECORATION WITH PEARLS 
20678,LARGE BLACK DIAMANTE HAIRSLIDE
90149,SILVER FLOWR PINK SHELL NECKLACE
84919,BLUE CUSHION COVER WITH FLOWER
21468,BUTTERFLY CROCHET FOOD COVER
22324,BLUE POLKADOT KIDS BAG
22459,CAST IRON HOOK GARDEN TROWEL
23439,HAND WARMER RED LOVE HEART
22772,PINK DRAWER KNOB ACRYLIC EDWARDIAN
21042,RED RETROSPOT APRON 
21472,LADYBIRD + BEE RAFFIA FOOD COVER
23465,TUSCAN VILLA BIRD FEEDER
90098,NECKLACE+BRACELET PINK BUTTERFLY
21758,VINTAGE SHELLS PRINT
84597B,RETRO BROWN BALL ASHTRAY 
22698,PINK REGENCY TEACUP AND SAUCER
22452,MEASURING TAPE BABUSHKA PINK
22084,PAPER CHAIN KIT EMPIRE
85129C,BEADED CRYSTAL HEART BLUE SMALL
85175,CACTI T-LIGHT CANDLES
22945,CHRISTMAS METAL TAGS ASSORTED 
22508,DOORSTOP RETROSPOT HEART
23245,SET OF 3 REGENCY CAKE TINS
85062,PEARL CRYSTAL PUMPKIN T-LIGHT HLDR
21277,FRENCH STYLE EMBOSSED HEART CABINET
90184C,BLACK CHUNKY BEAD BRACELET W STRAP
90036A,FLOWER GARLAND NECKLACE RED
21643,ASSORTED TUTTI FRUTTI MIRROR
47591B,SCOTTIES CHILDRENS APRON
20762,GREEN FERN SKETCHBOOK 
22321,BIRD DECORATION RED RETROSPOT
22839,3 TIER CAKE TIN GREEN AND CREAM
20893,HANGING BAUBLE T-LIGHT HOLDER SMALL
21382,SET/4 SPRING FLOWER DECORATION
90204,PAIR OF ENAMEL BUTTERFLY HAIRCLIP
16048,TEATIME ROUND PENCIL SHARPENER 
17012E,ORIGAMI OPIUM INCENSE/CANDLE SET 
22574,HEART WOODEN CHRISTMAS DECORATION
23088,ZINC HEART FLOWER T-LIGHT HOLDER
22696,WICKER WREATH LARGE
16202B,PASTEL BLUE PHOTO ALBUM 
84558A,3D DOG PICTURE PLAYING CARDS
90003C,MIDNIGHT BLUE PAIR HEART HAIR SLIDE
85232A,SET/3 POLKADOT STACKING TINS
22533,MAGIC DRAWING SLATE BAKE A CAKE 
85172,HYACINTH BULB T-LIGHT CANDLES
22519,CHILDS GARDEN BRUSH PINK
22468,BABUSHKA LIGHTS STRING OF 10
23580,SNACK TRAY HAPPY FOREST  
22858,EASTER TIN KEEPSAKE
84859B,BLUE DISCO HANDBAG
90141E,ORANGE PENDANT TRIPLE SHELL NECKLAC
22405,MONEY BOX POCKET MONEY DESIGN
23404,HOME SWEET HOME BLACKBOARD
84968E,SET OF 16 VINTAGE BLACK CUTLERY
84527,FLAMES SUNGLASSES PINK LENSES
84805B,BLUE CLIMBING HYDRANGA ART FLOWER
75011,BLUE DAISY MOBILE
22642,SET OF 4 NAPKIN CHARMS STARS   
16218,CARTOON  PENCIL SHARPENERS
21327,SKULLS WRITING SET 
22366,DOORMAT AIRMAIL 
90123B,TURQUOISE HEART OF GLASS BRACELET
C2,CARRIAGE
23160,REGENCY TEA SPOON
21422,PORCELAIN ROSE SMALL
22413,METAL SIGN TAKE IT OR LEAVE IT 
17007B,S/3 POT POURI CUSHIONS BLUE COLOURS
90029,NEW BAROQUE SMALL NECKLACE BLACK
21563,RED HEART SHAPE LOVE BUCKET 
82578,KITCHEN METAL SIGN
21715,GIRLS VINTAGE TIN SEASIDE BUCKET
21026,SPACE OWL
21669,BLUE STRIPE CERAMIC DRAWER KNOB
22601,CHRISTMAS RETROSPOT ANGEL WOOD
72130,COLUMBIAN CANDLE ROUND
85104,SILVER GLASS T-LIGHT SET
23141,TRIPLE WIRE HOOK PINK HEART
23154,SET OF 4 JAM JAR MAGNETS
23517,EMBROIDERED RIBBON REEL REBECCA 
90131,PINK/AMETHYST/GOLD NECKLACE
22947,WOODEN ADVENT CALENDAR RED
23405,HOME SWEET HOME 2 DRAWER CABINET
23480,MINI LIGHTS WOODLAND MUSHROOMS
22389,PAPERWEIGHT SAVE THE PLANET
90120D,WHITE MURANO TWIST BRACELET
22897,OVEN MITT APPLES DESIGN
90078,PINK/WHITE GLASS DEMI CHOKER
21169,YOU'RE CONFUSING ME METAL SIGN 
22068,BLACK PIRATE TREASURE CHEST
21215,IVORY PAPER CUP CAKE CASES 
21400,RED PUDDING SPOON
22464,HANGING METAL HEART LANTERN
21121,SET/10 RED POLKADOT PARTY CANDLES
72132,COLUMBIAN CUBE CANDLE
37448,CERAMIC CAKE DESIGN SPOTTED MUG
84978,HANGING HEART JAR T-LIGHT HOLDER
16151A,FLOWERS HANDBAG blue and orange
22303,COFFEE MUG APPLES DESIGN
22773,GREEN DRAWER KNOB ACRYLIC EDWARDIAN
84993A,75 GREEN PETIT FOUR CASES
22797,CHEST OF DRAWERS GINGHAM HEART 
85173,SET/6 FROG PRINCE T-LIGHT CANDLES
85185B,PINK HORSE SOCK PUPPET
21658,GLASS  BEURRE DISH
11001,ASSTD DESIGN RACING CAR PEN
90200B,BLACK SWEETHEART BRACELET
22816,CARD MOTORBIKE SANTA
21769,VINTAGE POST OFFICE CABINET
84576,BLUE CAT BISCUIT BARREL PINK HEART
21445,12 PINK ROSE PEG PLACE SETTINGS
84457,SET/3 RABBITS FLOWER SKIPPPING ROPE
21484,CHICK GREY HOT WATER BOTTLE
85231B,CINAMMON SET OF 9 T-LIGHTS
47420,ASSORTED COLOUR SUCTION CUP HOOK
35810A,ENAMEL PINK COFFEE CONTAINER
23174,REGENCY SUGAR BOWL GREEN
22070,SMALL RED RETROSPOT MUG IN BOX 
22910,PAPER CHAIN KIT VINTAGE CHRISTMAS
23692,WRAP A PRETTY THANK YOU
90199A,5 STRAND GLASS NECKLACE BLACK
84926F,PSYCHEDELIC TILE COASTER
90060D,FIRE POLISHED GLASS NECKL BRONZE
22553,PLASTERS IN TIN SKULLS
22487,WHITE WOOD GARDEN PLANT LADDER
82600,N0 SINGING METAL SIGN
21280,VINTAGE KITCHEN PRINT VEGETABLES
21907,I'M ON HOLIDAY METAL SIGN
90039D,FIRE POLISHED GLASS BRACELET GREEN
20831,GOLD PHOTO FRAME
85178,VICTORIAN SEWING KIT
22395,PAPERWEIGHT VINTAGE PAISLEY
21912,VINTAGE SNAKES & LADDERS
21129,SILVER FISHING GNOME 
22549,PICTURE DOMINOES
85106,CUT GLASS HEXAGON T-LIGHT HOLDER
22049,WRAP CHRISTMAS SCREEN PRINT
90024C,NEW BAROQUE B'FLY NECKLACE GREEN
21850,BLUE  DIAMANTE PEN IN GIFT BOX
15039,SANDALWOOD FAN
72741,GRAND CHOCOLATECANDLE
23074,EMBOSSED HEART TRINKET BOX
21922,UNION STRIPE WITH FRINGE  HAMMOCK
20967,GREY FLORAL FELTCRAFT SHOULDER BAG
84535A,ENGLISH ROSE NOTEBOOK A6 SIZE
37495,FAIRY CAKE BIRTHDAY CANDLE SET
85032C,CURIOUS IMAGES GIFT WRAP SET
23524,HORSE & PONY WALL ART
23491,VINTAGE JINGLE BELLS HEART
22675,FRENCH KITCHEN SIGN BLUE METAL
84051,ASS COLOUR GLOWING TIARAS
85186A,EASTER BUNNY GARLAND OF FLOWERS
44092B,BLUE WHITE PLASTIC RINGS LAMPSHADE
20835,FRENCH LATTICE CUSHION COVER 
23076,ICE CREAM SUNDAE LIP GLOSS
90000A,RASPBERRY ANT COPPER FLOWER NECKLAC
22813,PACK 3 BOXES BIRD PANETTONE 
84803B,WHITE ALLIUM  ARTIFICIAL FLOWER
21485,RETROSPOT HEART HOT WATER BOTTLE
22706,WRAP COWBOYS  
90214P,"LETTER 'P'"" BLING KEY RING"""
90036B,"FLOWER GLASS GARLAND NECKL.36'GREEN"""
22833,HALL CABINET WITH 3 DRAWERS
22539,MINI JIGSAW DOLLY GIRL
22826,LOVE SEAT ANTIQUE WHITE METAL
22752,SET 7 BABUSHKA NESTING BOXES
17091J,VANILLA INCENSE IN TIN
84358,FLOOR LAMP SHADE WOOD BASE
23479,WIRE EGG BASKET 
47369A,PINK GREEN EMBROIDERY COSMETIC BAG
84760S,SMALL HANGING GLASS+ZINC LANTERN
90173,PAIR BUTTERFLY HAIR CLIPS
23419,HOME SWEET HOME BOTTLE 
21881,CUTE CATS TAPE
23423,PANTRY 3 HOOK ROLLING PIN HANGER
20775,DAISY NOTEBOOK 
21865,PINK UNION JACK  PASSPORT COVER 
16258A,SWIRLY CIRCULAR RUBBERS IN BAG
90210B,CLEAR ACRYLIC FACETED BANGLE
22723,SET OF 6 HERB TINS SKETCHBOOK
22560,TRADITIONAL MODELLING CLAY
90214N,"LETTER 'N'"" BLING KEY RING"""
22294,HEART FILIGREE DOVE  SMALL
90210A,GREY ACRYLIC FACETED BANGLE
21880,RED RETROSPOT TAPE
23567,EGG CUP HENRIETTA HEN PINK
22700,BLACK AND WHITE DOG BOWL
85135C,RED DRAGONFLY HELICOPTER
23067,HANGING ENGRAVED METAL HEART
90025A,BAROQUE BUTTERFLY EARRINGS BLACK
20760,GARDEN PATH POCKET BOOK
81952B,ROUND BLUE CLOCK WITH SUCKER
84548,CROCHET BEAR RED/BLUE  KEYRING
90001A,ANTIQUE RASPBERRY FLOWER EARRINGS
21171,BATHROOM METAL SIGN 
21385,IVORY HANGING DECORATION  HEART
84632,DECORATIVE HANGING SHELVING UNIT
22423,REGENCY CAKESTAND 3 TIER
23216,LAUREL HEART ANTIQUE GOLD
21679,SKULLS  STICKERS
21126,SET OF 6 GIRLS CELEBRATION CANDLES
22475,SKULL DESIGN TV DINNER TRAY
23521,CAT AND BIRD WALL ART
20932,PINK POT PLANT CANDLE
21577,SAVE THE PLANET COTTON TOTE BAG
22876,NUMBER TILE COTTAGE GARDEN 8
21742,LARGE ROUND WICKER PLATTER 
23550,WRAP ALPHABET POSTER  
84849A,HELLO SAILOR BLUE SOAP HOLDER
84798B,PURPLE FOXGLOVE ARTIIFCIAL FLOWER
21792,CLASSIC FRENCH STYLE BASKET GREEN 
22848,BREAD BIN DINER STYLE PINK
84206A,3 BLACK CATS W HEARTS BLANK CARD
21058,PARTY INVITES WOODLAND
90011A,MIDNIGHT BLUE CRYSTAL DROP EARRINGS
23326,HANGING MINI COLOURED BOTTLES
22183,CAKE STAND VICTORIAN FILIGREE MED
44242B,PINK FEATHERS CURTAIN
22346,PARTY PIZZA DISH GREEN POLKADOT
21882,SKULLS TAPE
84613C,BLUE NEW BAROQUE FLOCK CANDLESTICK
22620,4 TRADITIONAL SPINNING TOPS
21351,CINAMMON & ORANGE WREATH
23121,PACK OF 6 COCKTAIL PARASOL STRAWS
21447,12 IVORY ROSE PEG PLACE SETTINGS
21363,HOME SMALL WOOD LETTERS
23168,CLASSIC CAFE SUGAR DISPENSER
22176,BLUE OWL SOFT TOY
79161A,ST GEORGE SET OF 10 PARTY LIGHTS
82599,FANNY'S REST STOPMETAL SIGN
21311,SET/4 BIRD MIRROR MAGNETS 
23345, DOLLY GIRL BEAKER
84415A,PINK FLOCK SUEDE CUSHION COVER 
21426,WOODLAND STORAGE BOX SMALL
22564,ALPHABET STENCIL CRAFT
44265,M/COLOUR POM-POM CURTAIN
21773,DECORATIVE ROSE BATHROOM BOTTLE
23451,SQUARE MINI PORTRAIT FRAME
23114,VINTAGE LEAF CHOPPING BOARD  
82613B,"METAL SIGN,CUPCAKE SINGLE HOOK"
90025F,BAROQUE BUTTERFLY EARRINGS CRYSTAL
23570,TRADITIONAL PICK UP STICKS GAME 
23225,CHERUB HEART DECORATION SILVER 
21196,ROUND WHITE CONFETTI IN TUBE
84997B,CHILDRENS CUTLERY RETROSPOT RED 
23469,CARD HOLDER LOVE BIRD SMALL
22489,PACK OF 12 TRADITIONAL CRAYONS
22755,SMALL PURPLE BABUSHKA NOTEBOOK 
90168,2 DAISIES HAIR COMB
22315,200 RED + WHITE BENDY STRAWS
21463,MIRRORED DISCO BALL 
21718,RED METAL BEACH SPADE 
23038,T-LIGHT HOLDER SILVER SAUCER
23006,TRAVEL CARD WALLET FLOWER MEADOW
85035B,CHOCOLATE 3 WICK MORRIS BOX CANDLE
84968A,SET OF 16 VINTAGE ROSE CUTLERY
22440,BALLOON WATER BOMB PACK OF 35
20778,GARDEN PATH NOTEBOOK 
23434,3 RAFFIA RIBBONS 50'S CHRISTMAS 
78033,FLAG OF ST GEORGE CHAIR
37343,POLKADOT MUG PINK 
23430,BLUE RETRO KITCHEN WALL CLOCK
21206,STRAWBERRY HONEYCOMB  GARLAND 
23538,WALL ART VINTAGE HEART
21368,MIRRORED WALL ART LADIES
90164B,WHITE  ROSEBUD PEARL BRACELET
84796B,BLUE SAVANNAH PICNIC HAMPER FOR 2
90209C,PINK ENAMEL+GLASS HAIR COMB
85159A,"BLACK TEA,COFFEE,SUGAR JARS"
22379,RECYCLING BAG RETROSPOT 
21883,STARS GIFT TAPE 
84625C,BLUE NEW BAROQUE CANDLESTICK CANDLE
23533,WALL ART GARDEN HAVEN 
22043,CHRISTMAS CARD SCREEN PRINT 
16259,PIECE OF CAMO STATIONERY SET
84613A,PINK NEW BAROQUE FLOCK CANDLESTICK
90067A,PINK VINTAGE VICTORIAN EARRINGS
21934,SKULL SHOULDER BAG
20705,MRS ROBOT SOFT TOY
90064B,BLACK VINTAGE  CRYSTAL EARRINGS
90214Y,"LETTER 'Y'"" BLING KEY RING"""
84520B,PACK 20 ENGLISH ROSE PAPER NAPKINS
79190D,RETRO PLASTIC DAISY TRAY
84593,CROCHET ROSE DES CLOTHES HANGER
90082B,DIAMANTE BOW BROOCH RED COLOUR
22677,FRENCH BLUE METAL DOOR SIGN 2
23090,VINTAGE GLASS T-LIGHT HOLDER
20819,SILVER TEDDY BEAR
90210D,PURPLE ACRYLIC FACETED BANGLE
22893,MINI CAKE STAND T-LIGHT HOLDER
85174,S/4 CACTI CANDLES
22725,ALARM CLOCK BAKELIKE CHOCOLATE
90124A,PINK MURANO TWIST NECKLACE
23115,RED APPLES CHOPPING BOARD   
23548,WRAP MAGIC FOREST 
84859C,PINK DISCO HANDBAG
21990,MODERN FLORAL STATIONERY SET
21268,VINTAGE BLUE TINSEL REEL
84522,PINK PARTY SUNGLASSES
23295,SET OF 12 MINI LOAF BAKING CASES
85006,SET 4 NURSERY DES ROUND BOXES
84916,HAND TOWEL PALE BLUE W FLOWERS
21427,SKULLS STORAGE BOX SMALL
22522,CHILDS GARDEN FORK BLUE 
16016,LARGE CHINESE STYLE SCISSOR
23535,BICYCLE SAFTEY WALL ART
23010,CIRCUS PARADE BABY GIFT SET
22602,CHRISTMAS RETROSPOT HEART WOOD
21888,BINGO SET
84874B,BLUE TRAVEL FIRST AID KIT
22981,PANTRY APPLE CORER
84692,BOX OF 24 COCKTAIL PARASOLS
20964,POLYESTER FILLER PAD 60x40cm
71496A,A4 WALL TIDY BLUE OFFICE
84509C,SET OF 4 POLKADOT PLACEMATS 
84711A,SILVER OVAL SHAPE TRINKET BOX
85040A,S/4 PINK FLOWER CANDLES IN BOWL
23396,BUTTERFLY CUSHION COVER
21307,SET/4 BUTTERFLY MIRROR MAGNETS
22940,FELTCRAFT CHRISTMAS FAIRY
40016,CHINESE DRAGON PAPER LANTERNS
21781,MA CAMPAGNE CUTLERY BOX
21278,VINTAGE KITCHEN PRINT PUDDINGS
22636,CHILDS BREAKFAST SET CIRCUS PARADE
84563A,PINK & WHITE BREAKFAST TRAY
35004C,SET OF 3 COLOURED  FLYING DUCKS
